asin,title,formFactor,count,price,listPrice,unitPrice,rating,reviewCount,isBestSeller,isAmazonChoice,isSponsored,isPrime,coupon,boughtPastMonth,searchQuery,image,url
B0CBSSTMGY,"2 Pack Lukaree Liver Cleanse Detox & Repair Gummies | Sugar-Free Milk Thistle Supplement w/Artichok & L-Glutathione - Ultra-Concentrated Herbal Liver Support for Men & Women -Vegan,60 Count",Gummy,2 Pack,23.96,$0.20,($0.20$0.20/count),4.2,1036,false,false,false,false,,1K+ bought in past month,THC gummies,https://m.media-amazon.com/images/I/716czuwCweL._AC_UL320_.jpg,
B0G922DD8X,"2 Packs Hemp Gummies for Sleep Pain Anxiety- with Natural Hemp Oil Extract Gummy Edibles Vegan, Non-GMO",Gummy,2 Pack,27.49,$0.17,($0.17$0.17/count),3.5,11,false,false,false,false,,,THC gummies,https://m.media-amazon.com/images/I/71BCINXVUuL._AC_UL320_.jpg,
B0F7LNSSF8,"Hemp Gummies 3 Packs High Potency Pure Organic Supplement - with Natural Hemp Oil Extract for Sleep, Pain, Anxiety Gummy Edibles Vegan, Non-GMO",Gummy,3 Pack,34.99,$0.15,($0.15$0.15/count),3.6,70,false,false,false,false,,,THC gummies,https://m.media-amazon.com/images/I/710jgqK3qyL._AC_UL320_.jpg,
B0F6NHTYDD,"2 Packs Hemp Gummies for Sleep, Pain, Anxiety - High Potency Advanced Extra Strength with Pure Natural Hemp Oil - Hеmp Gummy for Adults",Gummy,2 Pack,31.99,$0.20,($0.20$0.20/count),3.8,50,false,false,false,false,,,THC gummies,https://m.media-amazon.com/images/I/71mnLAdBuJL._AC_UL320_.jpg,
B09JL4PCQQ,"JOYLI Hemp Gummies - Natural Lung Cleanse with Mullein Leaf & Reishi Mushroom - Extra Strength Clean Lung Support Supplement with Vitamins A, C, D & E - Sugar-Free, Vegan, Non-GMO - 60 Edibles",Gummy,,18.99,$0.32,($0.32$0.32/count),3.8,1561,false,false,false,false,5% off coupon appliedSave 5%  with coupon,50+ bought in past month,THC gummies,https://m.media-amazon.com/images/I/81Y-vSKI+AL._AC_UL320_.jpg,
B0DNM7S2P1,"Lions Mane Mushroom Gummies with Ashwagandha, 4000mg 10-Mushroom Complex & 250mg Ashwagandha, Cognitive Support, Mood, Brain Health & Memory, Energy, Reishi, Cordyceps, Turkey Tail, Chaga, 60 Count",Gummy,60 Count,9.99,$0.17,($0.17$0.17/count),4.0,50,false,false,false,false,,,THC gummies,https://m.media-amazon.com/images/I/81gN+asrcjL._AC_UL320_.jpg,
B0D3FL73GH,"SMNutrition Mushroom Gummies for Adults | with Lions Mane, Turkey Tail, Reishi, Cordyceps, Chaga & Maitake | Support Cognitive Function & Immune Health | Raspberry Flavor | 60ct",Gummy,60ct,13.95,$0.23,($0.23$0.23/count),4.3,1174,false,false,false,false,when you subscribeExtra 20% off  when you subscribe,100+ bought in past month,THC gummies,https://m.media-amazon.com/images/I/8105Hidm8KL._AC_UL320_.jpg,
B0BLHVP4DJ,Hemp Gummies For Relaxation And Sleep-Fresh Hemp Oil Gummy Bear Candy Butterfly Shaped-Natural Hempseed Oil-Made In USA-100 Count,Gummy,100 Count,29.99,$0.30,($0.30$0.30/count),3.9,87,false,false,false,false,when you subscribeExtra 40% off  when you subscribe,50+ bought in past month,THC gummies,https://m.media-amazon.com/images/I/819ICwbzXtL._AC_UL320_.jpg,
B0DGKW18GV,"Vegan Iron Gummies Supplement with Vitamin C, B12, Folate & Turmeric - Energy & Immune Health | Gummy Iron Bisglycinate 18mg Gentle & Non-Constipating - Women & Men, 2 Pack",Gummy,2 Pack,36.99,$0.31,($0.31$0.31/count),4.6,168,false,false,false,false,23% off coupon appliedSave 23%  with coupon,500+ bought in past month,THC gummies,https://m.media-amazon.com/images/I/81fcbLRqa3L._AC_UL320_.jpg,
B0BJXMQDQT,"2PACK Hemp Gummies Premium Hemp Gummy Bears-for Sleep, Calm, Relax-Omega Hemp Oil, Natural High Potency Hemp Party Edibles-Made in USA",Gummy,2PACK,41.99,$0.35,($0.35$0.35/count),4.0,109,false,false,false,false,when you subscribeExtra 40% off  when you subscribe,,THC gummies,https://m.media-amazon.com/images/I/81FG0IuFRUL._AC_UL320_.jpg,
B0BWGCHXWH,Hemp Gummies Sleep Peach Ring Gummy Bears-Natural Hempseed Oil for Peace and Calm-Fresh Peach Hemp Candy Edibles-Natural Omega-Made in USA,Gummy,,31.99,$0.89,($0.89$0.89/count),3.4,34,false,false,false,false,when you subscribeExtra 40% off  when you subscribe,,THC gummies,https://m.media-amazon.com/images/I/7156Gn95N1L._AC_UL320_.jpg,
B0F6R2SNKY,Hemp Gummies Edibles for Relaxation-Calm and Peace Hempseed Oil Sleep Gummy Bears Candy-Made in USA-93 Count,Gummy,93 Count,28.99,$0.31,($0.31$0.31/count),4.1,85,false,false,false,false,when you subscribeExtra 40% off  when you subscribe,,THC gummies,https://m.media-amazon.com/images/I/81g+aBYbhQL._AC_UL320_.jpg,
B0BJXRXC3S,3PACK Hemp Gummies for Sleep-Fresh Fruity Gummy Bears-for Calm and Peace-Natural Hemp Edibles Party Candy-Made in USA,Gummy,3PACK,56.99,$0.32,($0.32$0.32/count),3.7,48,false,false,false,false,when you subscribeExtra 40% off  when you subscribe,,THC gummies,https://m.media-amazon.com/images/I/81vQgtG9Y-L._AC_UL320_.jpg,
B0GFMPW4MJ,"Hemp Gummies for Pain, Sleep, Anxiety - 3 Packs Hemp Gummy 100% Natural Organic Extra Strength High Potency with Pure Hеmp Oil Extract Vegan Bear Candy",Gummy,3 Pack,29.99,$0.12,($0.12$0.12/count),2.8,3,false,false,false,false,10% off coupon appliedSave 10%  with coupon,,THC gummies,https://m.media-amazon.com/images/I/71WOGnNHe1L._AC_UL320_.jpg,
B0FK2WVCY5,"Hemp & Mushroom Gummies 6500mg - Max Strength for Adults - Chill, Inflammation, Natural Pain, Restful Sleep (325mg Gummy) - by Hemp and Hand",Gummy,,39.99,$2.00,($2.00$2.00/count),4.6,9,false,false,false,false,,50+ bought in past month,THC gummies,https://m.media-amazon.com/images/I/61IwNb7rTnL._AC_UL320_.jpg,
B0BWGJMJ2S,"Hemp Gummies for Sleep, Deep Calm Night Time-Natural Hempseed Oil Omega Butterflies Gummy Candy-Made in USA-100 Count",Gummy,100 Count,29.99,$0.30,($0.30$0.30/count),4.0,167,false,false,false,false,,,THC gummies,https://m.media-amazon.com/images/I/81za2JVz8CL._AC_UL320_.jpg,
B0DJN8MV8R,"Hemp Gummies 3,500mg 120 Count | Extra Strength Hemp Oil for Stress Relief, Sleep & Pain Support | Natural Calm & Relaxation | Vegan | Non-GMO | Gluten-Free | Fruity Flavor | Made in USA",Gummy,120 Count,23.99,$0.20,($0.20$0.20/count),3.5,48,false,false,false,false,,,THC gummies,https://m.media-amazon.com/images/I/81SndHekFJL._AC_UL320_.jpg,
B07GJJT4J9,"Hemp Gummies - Made in USA - Omega 3 Supplement with Hemp Oil - Fruity Gummies for Joints, Muscles, Relax, Calm, Sleep, Skin and Nails",Gummy,,25.87,$0.43,($0.43$0.43/count),4.0,4052,false,false,false,false,20% off coupon appliedSave 20%  with coupon,50+ bought in past month,THC gummies,https://m.media-amazon.com/images/I/81RAqVTsA+L._AC_UL320_.jpg,
B08CKF6DQC,Gummies for Stress & Relaxation – 1M - Delicious Natural Fruit Flavors - Made in USA – Relaxing Gummies – 100ct,Gummy,100ct,23.95,$0.24,($0.24$0.24/count),4.1,745,false,false,false,false,,200+ bought in past month,THC gummies,https://m.media-amazon.com/images/I/71lpyN9-syL._AC_UL320_.jpg,
B088YQHH2Z,"Sea Moss Gummies - Natural Irish Sea Moss and Bladderwrack with Burdock Gummy - 60 Gummies - Vegan - Healthy Immune, Gut & Overall Wellness Support - Herbal Alkaline Supplements",Gummy,60 Gummies,22.99,$0.38,($0.38$0.38/count),4.5,5882,false,false,false,false,,200+ bought in past month,THC gummies,https://m.media-amazon.com/images/I/712GVqfOM-L._AC_UL320_.jpg,
B0G1TGVHM3,"(3 Packs) Hemp Gummies High Potency for Sleep, Pain, Anxiety- Pure Extra Strength Organic Hеmp Oil Gummies - 100% Natural Bear Hemp Gummy for Adults",Gummy,3 Pack,35.99,$0.15,($0.15$0.15/count),2.8,4,false,false,false,false,,,THC gummies,https://m.media-amazon.com/images/I/71D9U1BYSOL._AC_UL320_.jpg,
B0BK1XCVNR,"Hemp Gummies-Peach Rings Premium Hemp Oil Gummy Bears-Fresh and Full Flavor-Peach Infused Edibles-Great for Back, Rest, Knees, Calm, Relax, Discomfort-Made in USA",Gummy,,29.99,$1.07,($1.07$1.07/count),3.8,29,false,false,false,false,when you subscribeExtra 40% off  when you subscribe,,THC gummies,https://m.media-amazon.com/images/I/71KWwJApTFL._AC_UL320_.jpg,
B0D5JPDT4C,"Troomy Daily 14 Mushroom Blend Gummies - Great Tasting Natural Mango Strawberry Flavor, Gelatin-Free, Gluten-Free, Vegetarian - 30 Count",Gummy,30 Count,16.99,$0.57,($0.57$0.57/count),4.1,43,false,false,false,false,50% off coupon appliedSave 50%  with coupon,,THC gummies,https://m.media-amazon.com/images/I/71g4PzT4hML._AC_UL320_.jpg,
B0GJ92L77X,"Hemp Gummies High Potency for Sleep, Pain, Anxiety- Pure Extra Strength Organic Hеmp Oil Gummies - (3 Packs) 100% Natural Bear Hemp Gummy for Adults",Gummy,3 Pack,32.18,$0.13,($0.13$0.13/count),3.5,3,false,false,false,false,,,THC gummies,https://m.media-amazon.com/images/I/71D9U1BYSOL._AC_UL320_.jpg,
B0G4M9Q753,"Hemp Gummies for Pain Sleep,Anxiety Extra Strengthen High Potency with Pure Natural Organic Hemp Oil Extract Vegan Edible Low Sugar - 2 Pack",Gummy,2 Pack,22.39,$0.28,($0.28$0.28/count),3.4,10,false,false,false,false,,,THC gummies,https://m.media-amazon.com/images/I/71PpgJ5aDJL._AC_UL320_.jpg,
B0F9WLQL37,"Hemp Gummies for Sleep, Pain,Anxiety Organic High Potency Extra Strength Hemp Oil Extract Edible Gummy Supplement for Adult Gummy 2 Packs",Gummy,2 Pack,27.71,$0.17,($0.17$0.17/count),3.9,32,false,false,false,false,,,THC gummies,https://m.media-amazon.com/images/I/51VV41Vj6jL._AC_UL320_.jpg,
B09YGB43HV,Hemp Gummies - Pure Hemp Extract 50mg per Gummy - Total Hemp Extract 1500mg per Bottle - American Made - 100% Organic - Supreme Formula - Ultra Low Sugar - Strawberry Flavor,Gummy,,31.99,$1.07,($1.07$1.07/count),3.6,106,false,false,false,false,,,THC gummies,https://m.media-amazon.com/images/I/61R7tQ9tj9L._AC_UL320_.jpg,
B0GJ79KDWH,Hemp Gummies For Sleep And Calm-Hemp Oil Gummy Bears Edibles Fruity Candy-Made In USA-93 Bears,Gummy,,17.99,$1.38,($1.38$1.38/ounce),4.0,30,false,false,false,false,when you subscribeExtra 40% off  when you subscribe,,THC gummies,https://m.media-amazon.com/images/I/81xhBcJ2OZL._AC_UL320_.jpg,
B0BLHXFBWB,Hemp Gummies for Sleep-Fresh Peach Rings-Full Flavor Peach Gummy Bear Edibles Candy-Natural Hempseed Oil-Made in USA,Gummy,,29.99,$0.83,($0.83$0.83/count),4.0,56,false,false,false,false,when you subscribeExtra 40% off  when you subscribe,,THC gummies,https://m.media-amazon.com/images/I/81dHrUF2SGL._AC_UL320_.jpg,
B0GFH966JZ,"(2 Pack) Hemp Gummies for Sleep, Pain, Anxiety - Advanced Extra Strength Supplement with High Potency Pure Hemp Oil Extract - Best Edible Gummy for Adults",Gummy,2 Pack,39.99,$0.25,($0.25$0.25/count),4.2,8,false,false,false,false,,,THC gummies,https://m.media-amazon.com/images/I/71ot1kZRmvL._AC_UL320_.jpg,
B0G58FK8G9,"Hemp Gummies 2 Packs - High Potency Pure Organic Supplement - with Natural Hemp Oil Extract Edible Gummy Vegan, Non-GMO",Gummy,2 Pack,27.99,$0.17,($0.17$0.17/count),4.5,3,false,false,false,false,,,THC gummies,https://m.media-amazon.com/images/I/71M8Xc1wxoL._AC_UL320_.jpg,
B0B94T4H8B,Hemp Gummies for Sleep l theanine Supplement Hemp melatonin Triple Action - Calm Gummies for Adults and melatonin Kids - Sugar Free Strawberry Vegan 60 ct,Gummy,60 ct,29.99,$0.50,($0.50$0.50/count),4.1,33,false,false,false,false,,,THC gummies,https://m.media-amazon.com/images/I/51rLGLnmRdL._AC_UL320_.jpg,
B0G4GLKPRM,Omega 3-6-9 Gummies Vegan for Adults -0123,Gummy,9 Gummies,17.99,$0.11,($0.11$0.11/count),3.9,9,false,false,false,false,,,THC gummies,https://m.media-amazon.com/images/I/71SxViXCyDL._AC_UL320_.jpg,
B0F17P8R9B,"MYCL Dream Mushroom Gummies | 500mg Blend with Reishi Fruiting Body, L-Theanine, Valerian Root & Low-Dose Melatonin | Supports Deep Sleep & Stress Relief | Vegan, Organic, Gluten-Free | 30 Servings",Gummy,,39.99,$0.67,($0.67$0.67/count),4.8,9,false,false,false,false,,,THC gummies,https://m.media-amazon.com/images/I/813WBQj993L._AC_UL320_.jpg,
B0F34FFQW9,Tandy Energy Bursts Caffeine Gummies I Energy Boost Gummies with Zesty Fruit Blast Flavor I Caffeine from Green Tea Extract I Gluten-Free Fast-Acting Dietary Supplement Gummy I 6-Pack,Gummy,,20.94,$3.49,($3.49$3.49/count),4.0,35,false,false,false,false,,,THC gummies,https://m.media-amazon.com/images/I/61BdYLEeRvL._AC_UL320_.jpg,
B0F7RB4MTB,"Organic Gummies - No Artificial Colors or Flavors, Just Pure Goodness",Gummy,,19.99,$0.25,($0.25$0.25/count),5.0,1,false,false,false,false,,,THC gummies,https://m.media-amazon.com/images/I/61H8BdS6NPL._AC_UL320_.jpg,
B0CT31N3DQ,(3 Packs) Omega 3-6-9 Gummies for Adults,Gummy,3 Pack,29.99,$0.12,($0.12$0.12/count),4.2,57,false,true,false,false,,,THC gummies,https://m.media-amazon.com/images/I/71sqjDx4w7L._AC_UL320_.jpg,
B0G98MGLGL,"Natrol Sleep & Restore Magnesium Glycinate Blend Gummies, Magnesium for Sleep Aids for Adults, Melatonin-Free, Cherry Flavored, 30 Day Supply, 60 Gummies (Pack of 2)",Gummy,60 Gummies,34.99,$0.29,($0.29$0.29/count),4.0,2,false,false,false,false,,,THC gummies,https://m.media-amazon.com/images/I/61DNx31jGLL._AC_UL320_.jpg,
B0DZ6VPVDM,"(1 Packs) Hemp Gummies High Potency for Sleep, Pain, Anxiety - Pure Extra Strength Organic Hеmp Oil Gummies - 100% Natural Bear Hemp Gummy for Adults",Gummy,1 Pack,15.99,$0.20,($0.20$0.20/count),2.6,3,false,false,false,false,,,THC gummies,https://m.media-amazon.com/images/I/71Gjw1l+gRL._AC_UL320_.jpg,
B0CPL15Z6Y,"Legend - Hemp Gummies 2,000,000mg High Potency Natural Hemp Oil Infused Gummies for Restful Sleep, Calm, Inflammation – Fruity Flavors Organic Hemp Extract Gummies (60 Gummies)",Gummy,60 Gummies,21.99,$21.99,($21.99$21.99/count),3.1,38,false,false,false,false,,,THC gummies,https://m.media-amazon.com/images/I/61-2lI21C9L._AC_UL320_.jpg,
B0DZWNFTWY,"Hemp Gummies (2 Pack) - High Potency Advanced Extra Strength with Pure Natural Hemp Oil, Best Hеmp Gummies for Adults - Low Sugar",Gummy,2 Pack,25.99,$0.16,($0.16$0.16/count),4.2,5,false,false,false,false,,,THC gummies,https://m.media-amazon.com/images/I/61hiabI6Y5L._AC_UL320_.jpg,
B0DWV67FD9,"Evergreen Hemp Gummies - Ever Green Supplement Hemp Gummies - Maximum Strength, All Natural Overall Health and Wellness Support, Evergreen Health Gummy Reviews (3 Pack)",Gummy,3 Pack,39.95,$0.22,($0.22$0.22/count),3.5,5,false,false,false,false,,,THC gummies,https://m.media-amazon.com/images/I/81Vg3-tGg4L._AC_UL320_.jpg,
B0BJX6RCDV,"2PACK Hemp Gummies Butterflies-for Sleep, Calm and Peace-Natural Hemp Party Hemp Gummy Edibles-Made in USA",Gummy,2PACK,41.99,$0.28,($0.28$0.28/count),4.0,119,false,false,false,false,when you subscribeExtra 40% off  when you subscribe,,THC gummies,https://m.media-amazon.com/images/I/81mv7gqu8GL._AC_UL320_.jpg,
B0FFHBSFLB,"Hemp Gummies for Sleep, Stress, Anxiety, Pain, Relaxes Body & Mind, High Potency Organic Hemp Supplement, Natural Fruity Edible Gummies for Adult (1 Pack)",Gummy,1 Pack,13.99,$0.17,($0.17$0.17/count),3.5,4,false,false,false,false,,,THC gummies,https://m.media-amazon.com/images/I/71ySyoJrblL._AC_UL320_.jpg,
B0FC6J8QCV,Hemp Gummies High Potency Edible Bear Gummy for Adults Vegan (2 Packs),Gummy,2 Pack,28.99,$0.18,($0.18$0.18/count),3.7,20,false,false,false,false,,,THC gummies,https://m.media-amazon.com/images/I/71kXRT2SdOL._AC_UL320_.jpg,
B0CCWLX9SS,Exploro Weed Drug Test (50 Pack) – THC Tests for Home – Marijuana Detox THC Drug Test,,50 Pack,22.99,$0.46,($0.46$0.46/count),4.4,15919,false,false,false,false,,100+ bought in past month,THC gummies,https://m.media-amazon.com/images/I/713kIpX39zL._AC_UL320_.jpg,
B0DWTWZYR7,"Evergreen Hemp Gummies - Ever Green Supplement Hemp Gummies - Maximum Strength, All Natural Overall Health and Wellness Support, Evergreen Health Gummy Reviews (2 Pack)",Gummy,2 Pack,29.95,$0.25,($0.25$0.25/count),3.8,25,false,false,false,false,,,THC gummies,https://m.media-amazon.com/images/I/81FF269vwnL._AC_UL320_.jpg,
B0FWWCF2F1,1 Packs Hemp Gummies - High Potency Pure Organic Hеmp Oil Extract - 100% Natural Hemp Gummy - Vegan Non-GMO,Gummy,1 Pack,18.97,$0.24,($0.24$0.24/count),2.6,8,false,false,false,false,,,THC gummies,https://m.media-amazon.com/images/I/61OsHoWYt4L._AC_UL320_.jpg,
B0CPJV4L9K,"Ultimate Mushroom Daily Gummies - Mushroom Gummies with Cordyceps, Lion’s Mane, and Reishi, Plus Huperzine A & L-Theanine, May Improve Mood and Energy, Apple Berry Flavor, 60 Count",Gummy,60 Count,19.99,$0.33,($0.33$0.33/count),4.1,222,false,false,false,false,when you subscribeExtra 50% off  when you subscribe,200+ bought in past month,THC gummies,https://m.media-amazon.com/images/I/71x04BA2fmL._AC_UL320_.jpg,
B0DWTQZQ19,"Evergreen Hemp Gummies - Ever Green Supplement Hemp Gummies - Maximum Strength, All Natural Overall Health and Wellness Support, Evergreen Health Gummy Reviews (60 Gummies)",Gummy,60 Gummies,22.95,$0.38,($0.38$0.38/count),3.8,14,false,false,false,false,,,THC gummies,https://m.media-amazon.com/images/I/71sssv-3QRL._AC_UL320_.jpg,
B0DZHG5QJR,"Hemp Gummies (2 Packs), High Potency Edible Gummies Extra Strength Mood Focus Calm Organic Hemp Oil Extract Vegan Bear Gummy - 160 Counts Candy",Gummy,2 Pack,24.99,$0.16,($0.16$0.16/count),3.9,74,false,false,false,false,,,THC gummies,https://m.media-amazon.com/images/I/710OabnwsFL._AC_UL320_.jpg,
B0FL1YBJMM,"(3 Packs) Hemp Gummies High Potency for Sleep Anxiety Pain Relief Edibles Gummy Advanced Extra Strength - Vegan, Non-GMO",Gummy,3 Pack,25.98,$0.11,($0.11$0.11/count),,,false,false,false,false,,,THC gummies,https://m.media-amazon.com/images/I/71Jf0udd5iL._AC_UL320_.jpg,
B0FLVGS7MB,"Hemp Gummies High Potency Extra Strength Hemp Oil Extract Organic Edible Gummy Supplement for Adult Gummy for Sleep, Pain, Anxiety",Gummy,,21.99,$0.27,($0.27$0.27/count),4.0,22,false,false,false,false,,,THC gummies,https://m.media-amazon.com/images/I/61R8omkniSL._AC_UL320_.jpg,
B09JWXWKPQ,"Hemp Gummies for Peace and Relaxation-High Potency Hemp Oil Gummys Peach-Fresh Full Flavor-Natural Hemp Edibles-for Back, Knees, Calm, Sleep, Discomfort-36 Large Rings-Made in USA",Gummy,,30.99,$0.86,($0.86$0.86/count),3.8,91,false,false,false,false,when you subscribeExtra 40% off  when you subscribe,,THC gummies,https://m.media-amazon.com/images/I/61XNAk2NKoL._AC_UL320_.jpg,
B0CVM26NCK,"Premium Melatonin Sleep Gummies | Advanced Nighttime Blend with GABA, L-Theanine & Chamomile | Slumber Berry Vegan Gummies for Calm Relaxation & Restful Sleep | 30 Count",Gummy,30 Count,28.49,$0.95,($0.95$0.95/count),4.2,112,false,false,false,false,,100+ bought in past month,THC gummies,https://m.media-amazon.com/images/I/813hQj0kfdL._AC_UL320_.jpg,
B0FFYHM6LX,"Hemp Gummies for Sleep, Pain,Anxiety Organic High Potency Extra Strength Hemp Oil Extract Edible 2 Packs Gummy Supplement for Adult Gummy",Gummy,2 Pack,35.99,$0.22,($0.22$0.22/count),3.8,48,false,false,false,false,,,THC gummies,https://m.media-amazon.com/images/I/71SviBa6ykL._AC_UL320_.jpg,
B0FBR645T6,Hemp Gummies for Pain Sleep Relax Anxiety 100% Natural Pure Extra Strength Organic Hemp Oil Extract Vegan Low Sugar Edible Gummy for Adults(3 Pack),Gummy,3 Pack,28.99,$0.12,($0.12$0.12/count),4.0,18,false,true,false,false,,,THC gummies,https://m.media-amazon.com/images/I/71DVmeswQfL._AC_UL320_.jpg,
B0DWTF96X8,"Vanatera Gummies, Vanatera Hemp Gummies Extra Strength Formula, Vanatera Gummies 25mg Per Gummy 1500mg Per Bottle, Vanatera Gummies with Hemp for Overall Wellness Support, Made in USA (60 Gummies)",Gummy,60 Gummies,29.95,$0.50,($0.50$0.50/count),3.5,3,false,false,false,false,,,THC gummies,https://m.media-amazon.com/images/I/7149yAPnJJL._AC_UL320_.jpg,
B0DLLG1M9Y,"Bliss Roots Hemp Gummies with Hemp Seeds Organic Extract, BlissRoots Advanced Formula Gummy with Hemp Oil, Bliss Roots Hemp Gummies Reviews (3 Pack)",Gummy,3 Pack,42.95,$0.24,($0.24$0.24/ounce),2.4,2,false,false,false,false,,,THC gummies,https://m.media-amazon.com/images/I/81Bqq87Uz+L._AC_UL320_.jpg,
B0DPRWBKMW,Hemp Gummies -Natural Raspberry Flavor - Chewable Vitamins for Adults - 30 Gummies - 1 Pack,Gummy,30 Gummies,69.95,$69.95,($69.95$69.95/count),3.1,21,false,false,false,false,,,THC gummies,https://m.media-amazon.com/images/I/71aEplTkzvL._AC_UL320_.jpg,
B0BLWJH4WS,Hemp Gummies Fresh Peach Rings Gummy-Natural Hemp Oil Infused-Full Tasty Flavor-Best for Peace-Great Party Candy-Made in USA,Gummy,,31.99,$0.94,($0.94$0.94/count),4.0,23,false,false,false,false,when you subscribeExtra 40% off  when you subscribe,,THC gummies,https://m.media-amazon.com/images/I/81c4sksKWAL._AC_UL320_.jpg,
B0D4DFJ9DH,"Organic Hemp Gummies Nerve Support Supplement Neuropathy Pains, Natural Pure Hemp Oil Extract - L-Theanine Vitamin B2 Extra Strength High Potency Supplement Edible Vegan Gummy",Gummy,,21.99,$0.44,($0.44$0.44/count),3.3,32,false,false,false,false,,,THC gummies,https://m.media-amazon.com/images/I/81U8t8HWK7L._AC_UL320_.jpg,
B0DJ3TQ9JW,"Vitality Gummies - Vitality Hemp Gummies, Vitaly Official Formula Hemp Gummies - Natural Hemp Oil Advanced Formulation, Vitaloty Hemp Gummies Reviews (1 Packs - 60 Gummies)",Gummy,1 Pack,24.95,$0.42,($0.42$0.42/count),4.0,5,false,false,false,false,,,THC gummies,https://m.media-amazon.com/images/I/61VbewIGuiL._AC_UL320_.jpg,
B0C5PR1TRC,"(2 Pack) Regen Hemp Gummies - Official Formula - Regen Hemp Gummies Extra Strength Formula 25mg Per Gummy, 1500mg Per Bottle, Great Taste Big Size Assorted Flavor Gummy Bear Regen Gummys (120 Gummies)",Gummy,2 Pack,39.95,$0.33,($0.33$0.33/count),3.5,39,false,false,false,false,,,THC gummies,https://m.media-amazon.com/images/I/81iR11vzF5L._AC_UL320_.jpg,
B0FCNZL851,"Harmony Wave Gummies - Official Harmony Wave Supplement Hemp Gummys - Maximum Strength, All Natural Support for Overall Health and Wellness Support, Advanced HarmonyWave Gummy Reviews (60 Gummies)",Gummy,60 Gummies,29.95,$0.50,($0.50$0.50/count),,,false,false,false,false,,,THC gummies,https://m.media-amazon.com/images/I/71xeCEhCOFL._AC_UL320_.jpg,
B0D26Y1L81,"Bloom Hemp Gummies - Official Formula - Bloom Gummies with Hemp Advanced Strength Performance Hemp Blend Formula, Big Size Bloom Gomitas with 25mg Hemp Extract Great Taste 1500mg Bottle (60 Gummies)",Gummy,60 Gummies,24.95,$0.42,($0.42$0.42/count),3.5,62,false,false,false,false,,,THC gummies,https://m.media-amazon.com/images/I/714-jc9dLTL._AC_UL320_.jpg,
B0FNJX8VCQ,"Hemp Gummies 3 Packs - for Sleep, Pain, Anxiety - High Potency Pure Organic Supplement - with Natural Hemp Oil Extract Gummy Edibles Vegan, Non-GMO",Gummy,3 Pack,32.91,$0.14,($0.14$0.14/count),3.6,19,false,false,false,false,when you subscribeExtra 10% off  when you subscribe,,THC gummies,https://m.media-amazon.com/images/I/710jgqK3qyL._AC_UL320_.jpg,
B0DWTYZJ64,"Activ Pure Hemp Gummies - ActivPure Supplement Hemp Gummies - Maximum Strength, All Natural Overall Health and Wellness Support, Activ Pure Health Gummy Reviews (2 Pack)",Gummy,2 Pack,27.95,$0.23,($0.23$0.23/count),3.7,7,false,false,false,false,,,THC gummies,https://m.media-amazon.com/images/I/81CvCeyLu+L._AC_UL320_.jpg,
B0DF3XR8PC,"Tetra Bliss Gummies - TetraBliss Hemp Gummies, Tetra Bliss Official Formula Hemp Gummies - Natural Hemp Oil Advanced Formulation, Bliss Tetra Hemp Gummies Reviews (1 Pack - 60 Gummies)",Gummy,1 Pack,19.95,$0.33,($0.33$0.33/count),3.4,8,false,false,false,false,5% off coupon appliedSave 5%  with coupon,,THC gummies,https://m.media-amazon.com/images/I/61CpwmIugIL._AC_UL320_.jpg,
B0DMTXPSZZ,Organic Hemp Gummies Neuropathy Nerve Support Supplement Natural Pure Hemp Oil Extract - Pains Vitamin B2 Extra Strength Relief High Potency Edible Vegan Zen Leaf Made in USA,Gummy,,21.99,$0.44,($0.44$0.44/count),3.4,47,false,false,false,false,,,THC gummies,https://m.media-amazon.com/images/I/81LgluaTHPL._AC_UL320_.jpg,
B0CY922RD9,"BioHeal Hemp Gummies - with Hemp Seed Extract Bio Heal Hemp Gummies Tinnitus Herbal Supplement, Health and Wellness Support, All Natual Hemp Gummy Advanced Formula (2 Pack - 120 Gummies)",Gummy,2 Pack,33.99,$0.28,($0.28$0.28/count),4.7,10,false,false,false,false,,,THC gummies,https://m.media-amazon.com/images/I/71NL1bElhZL._AC_UL320_.jpg,
B0D3HND53W,"Naturals Fruit Hemp Gummies High Strength - Vegan Hemp Oil Infused Gummies Edibles Performance Great for Peace & Relaxation, Bloom Favorite Gummy",Gummy,,21.99,$0.44,($0.44$0.44/count),4.5,11,false,false,false,false,,,THC gummies,https://m.media-amazon.com/images/I/71d0HeOla4L._AC_UL320_.jpg,
B0DWV7YZL3,"Activ Pure Hemp Gummies - ActivPure Supplement Hemp Gummies - Maximum Strength, All Natural Overall Health and Wellness Support, Activ Pure Health Gummy Reviews (60 Gummies)",Gummy,60 Gummies,19.95,$0.33,($0.33$0.33/count),2.7,7,false,false,false,false,,,THC gummies,https://m.media-amazon.com/images/I/71lLKHdsjfL._AC_UL320_.jpg,
B0D3MBMH75,"Hemp Leaf Gummies - Official Formula - Hemp Leaf Gummies with Hemp Extract, Advanced Strength Zen Performance Hemp Blend, Zen Boost Hemp Gummies Maximum Strength, Fast Acting Zen Gummie (60 Gummies)",Gummy,60 Gummies,24.95,$0.42,($0.42$0.42/count),3.5,68,false,false,false,false,,,THC gummies,https://m.media-amazon.com/images/I/71IgoK0OWFL._AC_UL320_.jpg,
B0D3HFS3VS,Hemp Gummies High Potency Hemp Nature's Leaf Supplement Extra Strength with Pure Natural Hemp Oil Extract - Best Edible Hemp Gummy for Adult Made in USA,Gummy,,21.99,$0.44,($0.44$0.44/count),4.1,18,false,false,false,false,,,THC gummies,https://m.media-amazon.com/images/I/81i-8kDcLKL._AC_UL320_.jpg,
B0GHD23R6H,"Natrol Sleep + Restore Magnesium Glycinate Blend Gummies with Melatonin 5mg - Calm Magnesium with GABA,Botanical Blend,Cherry Flavor,60 Gummies,(Pack of 2)",Gummy,60 Gummies,38.30,$0.32,($0.32$0.32/count),4.1,643,false,false,false,false,,,THC gummies,https://m.media-amazon.com/images/I/81El7-bAxBL._AC_UL320_.jpg,
B0DRWBM1F2,"Tranquil Blend Gummies Hemp, Tranquil Blend Hemp Gummies with Hemp Seeds Organic Extract, TranquilBlend Extra Strength Health and Wellness Support, Advanced Formula with Hemp Oil Reviews (2 Pack)",Gummy,2 Pack,34.95,$0.29,($0.29$0.29/count),5.0,2,false,false,false,false,,,THC gummies,https://m.media-amazon.com/images/I/81e7z+keWBL._AC_UL320_.jpg,
B0DLZ83VV5,"(2 Pack) Bliss Roots Gummies - Official Formula - Bliss Roots Hemp Gummies, BlissRoots Gummies Maximum Strength Supplement Gummy, Bliss Roots Hemp Advanced Support, 1500mg Per Bottle (120 Gummies)",Gummy,2 Pack,37.95,$0.21,($0.21$0.21/count),3.9,13,false,false,false,false,,,THC gummies,https://m.media-amazon.com/images/I/81dMtJjAqPL._AC_UL320_.jpg,
