asin,title,formFactor,count,price,listPrice,unitPrice,rating,reviewCount,isBestSeller,isAmazonChoice,isSponsored,isPrime,coupon,boughtPastMonth,searchQuery,image,url
B0CJH5RWPD,"Create Creatine Monohydrate Gummies for Men & Women, Boost Focus, Strength, and Endurance, Anti-Melting Formula, Vegan, Gluten-Free, Non-GMO, 1.5g of Creatine per Gummy (Orange)",Gummy,,49.98,$0.56,($0.56$0.56/count),4.3,,false,false,false,false,,10K+ bought in past month,delta 9 gummies,https://m.media-amazon.com/images/I/71bRJSKoLeL._AC_UL320_.jpg,https://www.amazon.com/dp/B0CJH5RWPD
B0CMMN6WJ6,"Zenwise Health Digestive Enzymes with Bromelain & Papaya - Multi Enzymes Digestion Supplement with Probiotics & Prebiotics for Gut Health, Gas & Bloating Relief - Men & Women - 45 Vegetarian Capsules",Capsule,,14.97,$0.33,($0.33$0.33/count),4.4,,false,false,false,false,10% off coupon appliedSave 10%  with coupon,7K+ bought in past month,delta 9 gummies,https://m.media-amazon.com/images/I/71SZyEhXn8L._AC_UL320_.jpg,https://www.amazon.com/dp/B0CMMN6WJ6
B0F13Z71YM,"Vitamatic GLP-1 Support Supplement for Men & Women 60 Capsules - Made with Akkermansia, Probiotics, Prebiotic, Clostridium, Berberine, Cinnamon, Green Tea, Turmeric & Colostrum",Capsule,,14.99,$0.25,($0.25$0.25/count),3.9,,false,false,false,false,when you subscribeExtra 35% off  when you subscribe,500+ bought in past month,delta 9 gummies,https://m.media-amazon.com/images/I/51RfbwqsNUL._AC_UL320_.jpg,https://www.amazon.com/dp/B0F13Z71YM
B0FNMXWDD1,"Magnesium Glycinate Gummies 700MG - 21-in-1 Advanced Magnesium Supplement with Ashwagandha, L-Theanine, Zinc, Vitamin - Sugar Free Magnesium Gummies for zzZ, Focus & Relaxation, for Women, Men & Kids",Gummy,,17.97,$0.20,($0.20$0.20/count),4.8,,false,false,false,false,,100+ bought in past month,delta 9 gummies,https://m.media-amazon.com/images/I/71pxZPL8tTL._AC_UL320_.jpg,https://www.amazon.com/dp/B0FNMXWDD1
B0FM811SNQ,"Kids 4+ Magnesium + Saffron Sleep Gummies, Relax Happy Filled Gummy, Bedtime Calcium Zinc, Mineral + Multivitamin Gummies, Melatonin Free | Vitamin D3 K2 | Bone, Only Need 1 Gummy - Sweet Dream Magic",Gummy,,25.78,$0.43,($0.43$0.43/count),4.6,,false,false,false,false,$3.00 off coupon appliedSave $3.00  with coupon,700+ bought in past month,delta 9 gummies,https://m.media-amazon.com/images/I/818m5Pty0pL._AC_UL320_.jpg,https://www.amazon.com/dp/B0FM811SNQ
B0D8KNPQPJ,"Antioxidant & Brain Support Melatonin 60mg 30mg for 50+ Adults | High Dose Melatonin for Anti-Aging & Immune | Extra Strength Melatonin Gummies with B6, Ashwagandha, Magnesium, MSM - 60 Gummies",Gummy,60 Gummies,29.98,$0.50,($0.50$0.50/count),4.3,,false,false,false,false,,1K+ bought in past month,delta 9 gummies,https://m.media-amazon.com/images/I/81R7ivrmDIL._AC_UL320_.jpg,https://www.amazon.com/dp/B0D8KNPQPJ
B0B8QHLKYL,"Natural Probiotic Supplement - Non-GMO, Vegan, Gluten-Free",,,39.95,$1.33,($1.33$1.33/count),4.2,,false,false,false,false,when you subscribeExtra 10% off  when you subscribe,3K+ bought in past month,delta 9 gummies,https://m.media-amazon.com/images/I/81gttdnFqZL._AC_UL320_.jpg,https://www.amazon.com/dp/B0B8QHLKYL
B07JCY1ZCY,Omega 3 6 9 + DHA Gummies for Adults - Plant-Based Fish Oil Alternative with Chia Seed Oil and Algae - Support Brain and Immune Function - Lemon and Orange Flavors - Vegetarian Friendly - 60 Count,Gummy,60 Count,16.09,$0.27,($0.27$0.27/count),4.4,,false,false,false,false,when you subscribeExtra 12% off  when you subscribe,300+ bought in past month,delta 9 gummies,https://m.media-amazon.com/images/I/61P445s7z5L._AC_UL320_.jpg,https://www.amazon.com/dp/B07JCY1ZCY
B0BM8TBPBX,"Sugar Free Vitamin C + D3 + Zinc Gummies for Adults 50 +, 9 in 1 Immune Defense Supplement with D3 5000IU, Elderberry, Echinacea, Mullein Leaf for Boost Immunity, Power Antioxidant, Vegan (Pack of 2)",Gummy,,34.49,$0.29,($0.29$0.29/count),4.7,,false,false,false,false,$4.00 off coupon appliedSave $4.00  with coupon,1K+ bought in past month,delta 9 gummies,https://m.media-amazon.com/images/I/81KbwdvPvGL._AC_UL320_.jpg,https://www.amazon.com/dp/B0BM8TBPBX
B09Q8DSRBF,"GU Energy Chews, Variety Pack Energy Gummies with Electrolytes, Dairy-Free, On-The-Go Energy for Any Workout, 12 Bags (24 Servings Total)",Gummy,,31.00,$31.00,($31.00$31.00/count),4.6,,false,false,false,false,,1K+ bought in past month,delta 9 gummies,https://m.media-amazon.com/images/I/71uJziXOwoL._AC_UL320_.jpg,https://www.amazon.com/dp/B09Q8DSRBF
B0CQD3LBNR,Beast Bites - Valerian Infused Sleep & Nighttime Recovery Gummies - NSF Certified for Sport - 30 Servings,Gummy,,,,,4.0,,false,false,false,false,,500+ bought in past month,delta 9 gummies,https://m.media-amazon.com/images/I/71FuZaZ0GUL._AC_UL320_.jpg,https://www.amazon.com/dp/B0CQD3LBNR
B07WS3YSTP,"ONNIT Total Human Adult Multivitamin Comprehensive Capsule Packs with Day and Night Support, Daily Vitamin Packs for Men and Women, Dietary Supplement Capsules, 30-Day Supply, 60 Packs",Capsule,60 Pack,137.95,$4.60,($4.60$4.60/count),4.5,,false,false,false,false,,2K+ bought in past month,delta 9 gummies,https://m.media-amazon.com/images/I/71zlM+X6fhL._AC_UL320_.jpg,https://www.amazon.com/dp/B07WS3YSTP
B0F7NR5HSH,"Magnesium Glycinate Gummies 400mg Per Serving, 120 Count | Natural Grape Blueberry Flavor | Potent Elemental Form + Chelated for High Absorption | Healthy Muscle, Bones, & Mood Support Supplement",Gummy,120 Count,19.99,$0.17,($0.17$0.17/count),4.2,,false,false,false,false,,300+ bought in past month,delta 9 gummies,https://m.media-amazon.com/images/I/71Z-Fb0RTHL._AC_UL320_.jpg,https://www.amazon.com/dp/B0F7NR5HSH
B0DQVP7MQG,"Kappa Nutrition Powered by Magbrain™ Magnesium L-Threonate Plant-Based, 60 Vegan Capsules, 420mg Elemental Magnesium (3 Capsules) from 2,253mg, Brain, Sleep & Muscle Support.",Capsule,,17.99,$0.30,($0.30$0.30/count),4.6,,false,false,false,false,,8K+ bought in past month,delta 9 gummies,https://m.media-amazon.com/images/I/61EkY763YgL._AC_UL320_.jpg,https://www.amazon.com/dp/B0DQVP7MQG
B0BRMS8ZB1,"Vitamatic Sugar Free Vitamin D3 50,000 IU Weekly Supplement – 60 Pectin-Based Gummies High-Potency Vitamin D for Bone, Teeth & Immune Support",Gummy,,9.99,$0.17,($0.17$0.17/count),4.5,,false,false,false,false,,300+ bought in past month,delta 9 gummies,https://m.media-amazon.com/images/I/71SdcL6awtL._AC_UL320_.jpg,https://www.amazon.com/dp/B0BRMS8ZB1
B0BLRFQWDK,"Nutricost Mushroom Complex Supplement, 120 Capsules for 120 Servings per Bottle - 10 Mushroom Blend (Includes Reishi, Maitake, Shiitake, Lion's Mane, and More) - Non-GMO and Gluten Free",Capsule,,13.95,$0.12,($0.12$0.12/count),4.6,,false,false,false,false,,3K+ bought in past month,delta 9 gummies,https://m.media-amazon.com/images/I/615NSfpNcaL._AC_UL320_.jpg,https://www.amazon.com/dp/B0BLRFQWDK
B0CVC39FTL,"GU Energy Chews, Mixed Pack Gummies with Electrolytes, Vegan, Gluten-Free, Caffeine-Free, and Dairy-Free On-The-Go Energy for Any Workout,12 Bags (24 Servings Total), Flavors May Vary",Gummy,,31.00,$31.00,($31.00$31.00/count),4.6,,false,false,false,false,,500+ bought in past month,delta 9 gummies,https://m.media-amazon.com/images/I/71T5p3mOWpL._AC_UL320_.jpg,https://www.amazon.com/dp/B0CVC39FTL
B0DYQNC4D9,"Pre Workout Gummies – Tropical Blast, Long Lasting, No Crash Vegan Energy & Focus Boost, USA Made & GMP Certified with VasoDrive-AP and Vitamin B 12, for Men & Women (60 Count)",Gummy,60 Count,46.00,$0.77,($0.77$0.77/count),4.2,,false,false,false,false,,,delta 9 gummies,https://m.media-amazon.com/images/I/71JceB-y79L._AC_UL320_.jpg,https://www.amazon.com/dp/B0DYQNC4D9
B0F74VWPSR,"Neuro Energy & Focus Gum, Extra Strength - 100mg Natural Caffeine Gum & Nootropic Energy Supplement with L-Theanine & B Vitamins - Sugar Free, Vegan - Peppermint, 90ct",,90ct,36.99,$0.41,($0.41$0.41/count),4.4,,false,false,false,false,when you subscribeExtra 20% off  when you subscribe,7K+ bought in past month,delta 9 gummies,https://m.media-amazon.com/images/I/612j46LhSUL._AC_UL320_.jpg,https://www.amazon.com/dp/B0F74VWPSR
B0F9R3Z3XZ,"Bounce Pro Hydration Electrolyte Gummies – 75 Vegan Chewable Gummies with Sodium, Potassium & Magnesium for Running, Workouts & Endurance – No Sugar, Caffeine Free Electrolyte Chews, Blueberry Splash",Gummy,,46.99,$0.63,($0.63$0.63/count),3.4,,false,false,false,false,,,delta 9 gummies,https://m.media-amazon.com/images/I/714aU7JLOzL._AC_UL320_.jpg,https://www.amazon.com/dp/B0F9R3Z3XZ
B0FC95RMNL,"Instant Hydration Electrolytes Powder Packets - Raspberry Electrolyte Drink Mix - Zero Sugar - Keto, Vegan, Gluten-Free, Non-GMO - Boost Recovery, Brain Health, Muscle & Tissue Support- 30 Sticks",,,55.00,$6.96,($6.96$6.96/ounce),3.9,,false,false,false,false,,8K+ bought in past month,delta 9 gummies,https://m.media-amazon.com/images/I/51Oj5GXhedL._AC_UL320_.jpg,https://www.amazon.com/dp/B0FC95RMNL
B0BG6TGKZS,Clean Nutraceuticals Lions Mane 20in1 Mushroom Supplement with Turkey Tail Reishi Cordyceps Chaga Maitake Meshima Poria Cocos Shiitake Oyster Porcini Enoki - 1 Pack,,1 Pack,29.95,$0.50,($0.50$0.50/count),4.5,,false,false,false,false,when you subscribeExtra 5% off  when you subscribe,7K+ bought in past month,delta 9 gummies,https://m.media-amazon.com/images/I/81ScCfMVWpL._AC_UL320_.jpg,https://www.amazon.com/dp/B0BG6TGKZS
B0CCKX37YN,"Hemp Oil Capsules - 100% Organic Hemp Oil, 60,000 Max Strength, Supports Immune, Skin, Calm, Sleep & Overall Health - 180 Veggie Softgels",Capsule,,24.95,$0.14,($0.14$0.14/count),4.4,,false,false,false,false,10% off coupon appliedSave 10%  with coupon,200+ bought in past month,delta 9 gummies,https://m.media-amazon.com/images/I/71hIyCwhrRL._AC_UL320_.jpg,https://www.amazon.com/dp/B0CCKX37YN
B0CZF3ZHYL,"Super Greens + Super Fruits Gummies (Fruits/Greens Powder in Gummies Form) - 600mg Greens Blend + 600mg Fruits Blend for Immune Support, Sugar Free, Vegetarian, Non-GMO, 2-Pack (120 Gummies)",Gummy,120 Gummies,29.89,$0.25,($0.25$0.25/count),4.6,,false,false,false,false,when you subscribeExtra 10% off  when you subscribe,700+ bought in past month,delta 8 gummies,https://m.media-amazon.com/images/I/71y+uPzXQML._AC_UL320_.jpg,https://www.amazon.com/dp/B0CZF3ZHYL
B0DHZD354B,"Super Greens Multivitamin Gummies, Daily Greens Superfood Gummies w/Spirulina, Chlorella, Multivitamins, Prebiotic Fiber, Adaptogens, Support Digestive & Gut Health, Immunity, Focus & Energy, 120Cts",Gummy,120Ct,36.99,$0.31,($0.31$0.31/count),4.4,,false,false,false,false,27% off coupon appliedSave 27%  with coupon,1K+ bought in past month,delta 8 gummies,https://m.media-amazon.com/images/I/819iAzWH7mL._AC_UL320_.jpg,https://www.amazon.com/dp/B0DHZD354B
B0F1W8HKPP,Sports Research,,,24.95,$0.42,($0.42$0.42/count),4.4,,false,false,false,false,,1K+ bought in past month,delta 8 gummies,https://m.media-amazon.com/images/I/61VoqV2uzeL._AC_UL320_.jpg,https://www.amazon.com/dp/B0F1W8HKPP
B08MQP5C91,Natures Craft,,,19.99,$0.22,($0.22$0.22/count),4.5,,false,false,false,false,,50+ bought in past month,delta 8 gummies,https://m.media-amazon.com/images/I/71gFRMyZAoL._AC_UL320_.jpg,https://www.amazon.com/dp/B08MQP5C91
B0859JR5GL,"Caffeine Energy Chew 3-Pack, 200mg of Caffeine per Pack! Caffeine Boost, Coffee Energy Gummy, Mocca Shots High Energy Gummies, Vegan, Plant-Based, Gluten-Free (pack of 3)",Gummy,,10.19,$6.79,($6.79$6.79/ounce),3.6,,false,false,false,false,,50+ bought in past month,delta 8 gummies,https://m.media-amazon.com/images/I/71yoO8EBS+L._AC_UL320_.jpg,https://www.amazon.com/dp/B0859JR5GL
B07J4GMCNN,"Dairyland American Ginseng Gummies – 1000mg per Serving – Lemon Flavor, Caffeine-Free Energy & Focus Support Wisconsin Ginseng Gummy – 60 pcs",Gummy,60 pcs,19.99,$5.00,($5.00$5.00/ounce),4.1,,false,false,false,false,,,delta 8 gummies,https://m.media-amazon.com/images/I/61D0em14ZgL._AC_UL320_.jpg,https://www.amazon.com/dp/B07J4GMCNN
B0DK551JMK,"Omega 3 Gummies Supplement 1000mg, High Absorption DHA & EPA, Heart, Brain & Joint Support, Extra Strength Fish Oil Omega 3 Gummies Vitamins, 60 Count",Gummy,3 Gummies,12.99,$0.22,($0.22$0.22/count),4.4,,false,false,false,false,,100+ bought in past month,delta 8 gummies,https://m.media-amazon.com/images/I/71dZWoePZBL._AC_UL320_.jpg,https://www.amazon.com/dp/B0DK551JMK
B0DD217H39,"Men's Multivitamin Gummies, Supports Immune Health, Energy, Metabolism and Muscles with Vitamins A,C,D,B6,B12, 150 Men's Daily Multivitamin Gummies, 75 Day Supply",Gummy,,4.99,$0.03,($0.03$0.03/count),4.5,,false,false,false,false,,2K+ bought in past month,delta 8 gummies,https://m.media-amazon.com/images/I/61W6dzz97CL._AC_UL320_.jpg,https://www.amazon.com/dp/B0DD217H39
B0CVMWFC9D,"Premium Melatonin Sleep Gummies | Advanced Nighttime Blend with GABA, L-Theanine & Chamomile | Slumber Berry Vegan Gummies for Calm Relaxation & Restful Sleep | 60 Count",Gummy,60 Count,52.24,$0.87,($0.87$0.87/count),4.2,,false,false,false,false,,100+ bought in past month,delta 8 gummies,https://m.media-amazon.com/images/I/81TZy2wZNTL._AC_UL320_.jpg,https://www.amazon.com/dp/B0CVMWFC9D
B0G3S17DBY,Hemp Gummies for Sleep Night Time and Hemp Gummies for Daytime Boost-Deliciouos Gummy Candy-2Pack-Made in USA,Gummy,2Pack,22.99,$0.19,($0.19$0.19/count),3.9,,false,false,false,false,when you subscribeExtra 40% off  when you subscribe,,delta 8 gummies,https://m.media-amazon.com/images/I/71q4WpgzdhL._AC_UL320_.jpg,https://www.amazon.com/dp/B0G3S17DBY
B0DBLZ4YJP,"ad hoc 1100mg Gold Shilajit Gummies with Magnesium, Lions Mane, Rhodiola, Grape Seed - Himalayan Shilajit for Men Women, 85+ Trace Minerals & Fulvic Acid, Pure Shilajit for Energy Immune Support,60 Ct",Gummy,60 Ct,24.99,$0.42,($0.42$0.42/count),4.4,,false,false,false,false,,,hemp gummies THC,https://m.media-amazon.com/images/I/81-i6OFBgIL._AC_UL320_.jpg,https://www.amazon.com/dp/B0DBLZ4YJP
B0DFMV1PN5,Clean Nutraceuticals Coq10 Gummies | Red Yeast Rice Hawthorn Berry Ginger Turmeric Citrus Bergamot Hibiscus Vitamin K2+D3 Magnesium Glycinate Cayenne Pepper Fenugreek Orange Flavor CardiGuard,Gummy,10 Gummies,19.95,$0.33,($0.33$0.33/count),4.4,,false,true,false,false,when you subscribeExtra 5% off  when you subscribe,900+ bought in past month,hemp gummies THC,https://m.media-amazon.com/images/I/71QCgm8t-FL._AC_UL320_.jpg,https://www.amazon.com/dp/B0DFMV1PN5
B0D6NDJ54R,"Vitamatic Pumpkin Seed 20:1 Extract & Saw Palmetto 10:1 Extract Gummies – Sugar-Free Botanical Extract – Natural Raspberry Flavor – Vegan, Non-GMO, Plant-Based Gummies – 60 Count - 2 Pack (120 Count)",Gummy,60 Count,19.99,$0.17,($0.17$0.17/count),4.5,,false,false,false,false,,600+ bought in past month,hemp gummies THC,https://m.media-amazon.com/images/I/71fcpHIADmL._AC_UL320_.jpg,https://www.amazon.com/dp/B0D6NDJ54R
B0DW428VK2,"Vitamatic Chamomile 250 mg Capsules – Concentrated Herbal Supplement – Vegetarian, Non-GMO, Gluten-Free – 240 Count",Capsule,240 Count,9.99,$0.04,($0.04$0.04/count),4.6,,false,false,false,false,,200+ bought in past month,hemp gummies THC,https://m.media-amazon.com/images/I/517WE98+emL._AC_UL320_.jpg,https://www.amazon.com/dp/B0DW428VK2
B0DS6M5F1G,"STIRLING Organic Hemp Oil - 600,000mg Natural Berry Flavor - Enhances Sleep and Helps Reduce Discomfort - THC-Free, Non-GMO, Gluten-Free, High in Omega 3 6 9 - Premium U.S. Hemp Seed Oil",Tincture,,34.99,$34.99,($34.99$34.99/fluid ounce),4.4,,false,false,false,false,,,hemp gummies THC,https://m.media-amazon.com/images/I/81V6g1TR36L._AC_UL320_.jpg,https://www.amazon.com/dp/B0DS6M5F1G
B0FNX2WB8T,"(3-Pack) Hemp Oil Drops High Potency - for Pain Relief, Skin, Anxiety Maximum Strength Natural Hemp Oil - Organic Hemp Oils Extract Relieve Good Mood",Tincture,,26.98,$8.99,($8.99$8.99/fluid ounce),4.2,,false,false,false,false,,,hemp gummies THC,https://m.media-amazon.com/images/I/419xq++ndOL._AC_UL320_.jpg,https://www.amazon.com/dp/B0FNX2WB8T
B0DQFSLXX4,"Dr. Joseph's VetPro Complete Advanced Calming Aid Dog Chew Treats, 60 Count, Support for Nervous Dogs, Enhanced with Organic Hemp Seed Oil, Veterinarian Formulated",Tincture,60 Count,29.95,$0.50,($0.50$0.50/count),4.0,,false,false,false,false,,,hemp gummies THC,https://m.media-amazon.com/images/I/711zt-T+oeL._AC_UL320_.jpg,https://www.amazon.com/dp/B0DQFSLXX4
B0DLQGLZZZ,"Harmony Glow Gummies - Harmony Glow Hemp Gummies (2 Pack, 120 Gummies)",Gummy,2 Pack,37.99,$0.32,($0.32$0.32/count),3.0,,false,false,false,false,,,hemp gummies THC,https://m.media-amazon.com/images/I/61gkOvR7aVL._AC_UL320_.jpg,https://www.amazon.com/dp/B0DLQGLZZZ
B07DVQFKZ6,Turmeric Curcumin Supplement with Hemp Seeds & Lemon Balm Extract – Joint Health & Mobility – with Black Pepper for Absorption – Natural Joint Supplement for Men & Women,,,23.97,$0.40,($0.40$0.40/count),4.5,,false,false,false,false,when you subscribeExtra 40% off  when you subscribe,100+ bought in past month,hemp gummies THC,https://m.media-amazon.com/images/I/71q111w6tVL._AC_UL320_.jpg,https://www.amazon.com/dp/B07DVQFKZ6
B0D79SJ19W,"Herbal Harmony Gummies for Men and Women - Herbal Harmony Gummy, Herbal Harmony Infused with Hemp Extract, Herbal Harmony Natural Hemp Supplement Reviews (2 Pack - 120 Gummies)",Gummy,2 Pack,29.95,$0.25,($0.25$0.25/count),,,false,false,false,false,,,hemp gummies THC,https://m.media-amazon.com/images/I/71eyAns2iJL._AC_UL320_.jpg,https://www.amazon.com/dp/B0D79SJ19W
B082BK5B7Q,"Medical Miracles 6000 MG Maximum Strength Healing Salve Use for Hips, Joints, Neck, Back. Made with the Finest Available Ingredients",,,138.96,$69.48,($69.48$69.48/ounce),4.2,,false,false,false,false,when you subscribeExtra 15% off  when you subscribe,,CBD THC gummies,https://m.media-amazon.com/images/I/61p0025QWtL._AC_UL320_.jpg,https://www.amazon.com/dp/B082BK5B7Q
B0DWTDJY31,"(5 Pack) Vanatera Gummies, Vanatera Hemp Gummies Extra Strength Formula, Vanatera Gummies 25mg Per Gummy 1500mg Per Bottle, Vanatera Gummies with Hemp for Overall Wellness Support, USA (300 Gummies)",Gummy,5 Pack,69.95,$0.23,($0.23$0.23/count),5.0,,false,false,false,false,,,CBD THC gummies,https://m.media-amazon.com/images/I/81KlafsDqbL._AC_UL320_.jpg,https://www.amazon.com/dp/B0DWTDJY31
B0FXMLKYYN,Organic Hemp Gummies High Potency for Pain Sleep Anxiety Advanced Extra Strength Edible Pure Hemp Oil Extract Relaxing Gummy Low Sugar (1-Pack),Gummy,,17.99,$0.22,($0.22$0.22/count),4.1,,false,false,false,false,,,hemp derived THC edibles,https://m.media-amazon.com/images/I/613UazfjH-L._AC_UL320_.jpg,https://www.amazon.com/dp/B0FXMLKYYN
B0D7MC83LB,"3 Pack Hemp Gummies for Sleep, Pain, Anxiety 100% Natural Organic Hemp Supplement for Adults - High Potency Pure Hemp Oil Extract Edibles Gummy - Vegan, Non-GMO",Gummy,3 Pack,19.99,$0.08,($0.08$0.08/count),4.0,,false,false,false,false,,,hemp derived THC edibles,https://m.media-amazon.com/images/I/71DFUATEk0L._AC_UL320_.jpg,https://www.amazon.com/dp/B0D7MC83LB
B0F5PQ1MCH,"HOOLOO Hemp Gummies 350,000mg - 2 Packs Fruity Hemp Gummy Infused Omega 3, Vitamins for Adult, Made in USA",Gummy,2 Pack,17.58,$8.79,($8.79$8.79/count),3.7,,false,false,false,false,when you subscribeExtra 10% off  when you subscribe,50+ bought in past month,hemp derived THC edibles,https://m.media-amazon.com/images/I/81IBrKDHO-L._AC_UL320_.jpg,https://www.amazon.com/dp/B0F5PQ1MCH
B0FL1RHN67,(3 Packs) Organic Hemp Gummies High Potency for Pain Anxiety Sleep Edibles Gummy Hemp Oil Extract - Vegan Non-GMO,Gummy,3 Pack,21.98,$0.09,($0.09$0.09/count),5.0,,false,false,false,false,,,hemp derived THC edibles,https://m.media-amazon.com/images/I/71zQDnySHxL._AC_UL320_.jpg,https://www.amazon.com/dp/B0FL1RHN67
B0BP2R4NM4,"(4-Pack) High Potency Hemp Oil - Maximum Strength, Immune System Support, Focus Calm, Relaxation, Mood, Pure Extract, Organic, Vegan, Non-GMO",Tincture,,29.95,$7.49,($7.49$7.49/fluid ounce),4.2,,false,false,false,false,,700+ bought in past month,hemp derived THC edibles,https://m.media-amazon.com/images/I/71USacS5y0L._AC_UL320_.jpg,https://www.amazon.com/dp/B0BP2R4NM4
B0D2BKJPMM,Natural Hemp Gummies High Potency Pure Organic Hemp Oil Supplement - Natural Edibles Gummies Gomitas Vegan Advanced,Gummy,,21.99,$0.44,($0.44$0.44/count),4.1,,false,false,false,false,,,hemp derived THC edibles,https://m.media-amazon.com/images/I/71f8So9QUmL._AC_UL320_.jpg,https://www.amazon.com/dp/B0D2BKJPMM
B0F8VZ4LWR,"3 Packs Organic Hemp Gummies High Potency with Pure Hemp Oil Extract Vegan Edible Bear Candy - Non-GMO, Vegan, Low Sugar",Gummy,3 Pack,39.99,$0.25,($0.25$0.25/count),,,false,false,false,false,,,hemp derived THC edibles,https://m.media-amazon.com/images/I/71PdGxpP1UL._AC_UL320_.jpg,https://www.amazon.com/dp/B0F8VZ4LWR
B0D697YHP8,Natural Hemp Gummies 1 Pack High Potency - Vegan Hemp Oil Infused Supplement Edibles Performance L-Theanine GABA Ashwagandha Focus Calmwell Bloom Favorite Gummy,Gummy,1 Pack,21.99,$0.44,($0.44$0.44/count),3.8,,false,false,false,false,,,hemp derived THC edibles,https://m.media-amazon.com/images/I/71SEBD0WveL._AC_UL320_.jpg,https://www.amazon.com/dp/B0D697YHP8
B0D32WH58X,Organic Hemp Gummies Natural Pure Hemp Oil Extract - Extra Strength High Potency ed Edible Vegan Gummy Made in USA,Gummy,,21.99,$0.44,($0.44$0.44/count),4.3,,false,false,false,false,,,hemp derived THC edibles,https://m.media-amazon.com/images/I/61J0oc4RsYL._AC_UL320_.jpg,https://www.amazon.com/dp/B0D32WH58X
B0D3JFZBFQ,Naturals Organic Hemp Gummies High Strength - Nature's Leaf Vegan Hemp Oil Infused Edibles L-Theanine Ashwagandha Herbal Harmony Gummy,Gummy,,21.99,$0.44,($0.44$0.44/count),3.8,,false,false,false,false,,,hemp derived THC edibles,https://m.media-amazon.com/images/I/81Ah7r24tRS._AC_UL320_.jpg,https://www.amazon.com/dp/B0D3JFZBFQ
B0D3HRK91X,Hemp Gummies Advanced Extra Strength Infused Natural Organic Hemp Oil Bloom Vegan Adult Edibles Men L-Theanine Ashwagandha Sugar Made in USA,Gummy,,21.99,$0.44,($0.44$0.44/count),2.0,,false,false,false,false,,,hemp derived THC edibles,https://m.media-amazon.com/images/I/71vFzpmAvcL._AC_UL320_.jpg,https://www.amazon.com/dp/B0D3HRK91X
B0FSRHF87Y,Hemp Gummies High Potency Natural for Adults (Raspberry),Gummy,,9.99,$0.12,($0.12$0.12/count),2.0,,false,false,false,false,,,hemp derived THC edibles,https://m.media-amazon.com/images/I/61Lr6MLq-bL._AC_UL320_.jpg,https://www.amazon.com/dp/B0FSRHF87Y
B0BPDVXB4W,Canna Dreams Premium Hemp Gummies (Strawberry Lemonade),Gummy,,,,,5.0,,false,false,false,false,,,hemp derived THC edibles,https://m.media-amazon.com/images/I/51i0RLleZkL._AC_UL320_.jpg,https://www.amazon.com/dp/B0BPDVXB4W
B07SPDZ48B,"Tangerine Hemp Candy Drop Tincture - 1000mg, Available - Colorado Grown - Colorado Extracted - Non GMO - Vegan and Organic (1000 mg)",Tincture,,,,,,,false,false,false,false,,,hemp derived THC edibles,https://m.media-amazon.com/images/I/5187rfqRREL._AC_UL320_.jpg,https://www.amazon.com/dp/B07SPDZ48B
B09JTSXD6G,"Hemp Gummies-Best Tasting Peach Rings Gummy-Fresh Full Natural Hemp Oil-Relax, Sleep, Discomfort, Back, Knees-Made in USA",Gummy,,23.99,$0.96,($0.96$0.96/count),4.3,,false,false,false,false,when you subscribeExtra 40% off  when you subscribe,,hemp derived THC edibles,https://m.media-amazon.com/images/I/614ffO-q4SL._AC_UL320_.jpg,https://www.amazon.com/dp/B09JTSXD6G
B0FSRK7LT7,Hemp Gummies High Potency Natural for Adults (Mulberry),Gummy,,9.99,$0.12,($0.12$0.12/count),4.0,,false,false,false,false,,,hemp derived THC edibles,https://m.media-amazon.com/images/I/61dZcqUVbPL._AC_UL320_.jpg,https://www.amazon.com/dp/B0FSRK7LT7
B0FSR5KNW5,Hemp Gummies High Potency Natural for Adults (Peach),Gummy,,9.99,$0.12,($0.12$0.12/count),,,false,false,false,false,,,hemp derived THC edibles,https://m.media-amazon.com/images/I/61IHB2ZPAwL._AC_UL320_.jpg,https://www.amazon.com/dp/B0FSR5KNW5
B078X3GVS5,Bolder Caramels - Hemp Oil Infused Supplement - 10 mg per Piece - 3 Packs of 5 Caramels,Tincture,3 Pack,34.99,$2.33,($2.33$2.33/count),4.2,,false,false,false,false,,,hemp derived THC edibles,https://m.media-amazon.com/images/I/717c-nL12mL._AC_UL320_.jpg,https://www.amazon.com/dp/B078X3GVS5
B07SPTW8RG,"Watermelon Hemp Candy Drop Tincture - 250mg, Available - Colorado Grown - Colorado Extracted - Non GMO - Vegan and Organic (250 mg)",Tincture,,,,,,,false,false,false,false,,,hemp derived THC edibles,https://m.media-amazon.com/images/I/51zc2wyQuKL._AC_UL320_.jpg,https://www.amazon.com/dp/B07SPTW8RG
B0CLSDXTNZ,"Nufarm Gummies - Official Formula - Nufarm Hemp Gummies Premium Blend Hemp Gummies, Nufarm Hemp Advanced Formula 25mg per Gummy, 1500mg Per Bottle,Big Size Great Taste New 2023 Gummy (60 Gummies)",Gummy,60 Gummies,29.95,$0.50,($0.50$0.50/count),3.7,,false,false,false,false,,,hemp derived THC edibles,https://m.media-amazon.com/images/I/61V88uBaHWL._AC_UL320_.jpg,https://www.amazon.com/dp/B0CLSDXTNZ
B09JTV4QPX,"Hemp Gummy Bears for Calm and Peace-Fruity Flavor Natural Hemp Oil-for Chill, Sleep, Knees, Back-60 Gummies-Made in USA",Gummy,60 Gummies,21.99,$1.83,($1.83$1.83/ounce),3.6,,false,false,false,false,,,hemp derived THC edibles,https://m.media-amazon.com/images/I/61gQ1cF9nAL._AC_UL320_.jpg,https://www.amazon.com/dp/B09JTV4QPX
B0CHGYK85S,"Earth Med Gummies - EarthMed Hemp Gummies (Single, 60 Gummies)",Gummy,60 Gummies,21.95,$0.37,($0.37$0.37/count),3.2,,false,false,false,false,,,hemp derived THC edibles,https://m.media-amazon.com/images/I/61SGJ3GBIYL._AC_UL320_.jpg,https://www.amazon.com/dp/B0CHGYK85S
B0FSRK3KF7,Hemp Gummies High Potency Natural for Adults (Kumquat),Gummy,,9.99,$0.12,($0.12$0.12/count),,,false,false,false,false,,,hemp derived THC edibles,https://m.media-amazon.com/images/I/616DVOpRmYL._AC_UL320_.jpg,https://www.amazon.com/dp/B0FSRK3KF7
B0FSRK7LTL,Hemp Gummies High Potency Natural for Adults (Lime),Gummy,,9.99,$0.12,($0.12$0.12/count),,,false,false,false,false,,,hemp derived THC edibles,https://m.media-amazon.com/images/I/61H5Cv63o0L._AC_UL320_.jpg,https://www.amazon.com/dp/B0FSRK7LTL
