asin,title,formFactor,count,price,listPrice,unitPrice,rating,reviewCount,isBestSeller,isAmazonChoice,isSponsored,isPrime,coupon,boughtPastMonth,searchQuery,image,url
B0CCL4DGM6,"(2Pack) Hemp Oil Capsules - 60,000 Maximum Strength, Immune Support, Focus Calm, Relaxation, Mood, Rich in Omega 3, 6, 9 Fatty Acids - 90 Capsules",Capsule,2Pack,26.95,$0.15,($0.15$0.15/count),4.4,250,false,false,false,false,10% off coupon appliedSave 10%  with coupon,300+ bought in past month,hemp gummies THC,https://m.media-amazon.com/images/I/71ELZ-lyHHL._AC_UL320_.jpg,
B0FHQRBFH9,"Full Body Cleanse Detox Gummies, Liver, Gut & Kidney Cleanse Detox & Repair with Milk Thistle & Duck Flower Plant, Complete Digestive Health Supplement, Heavy Metal Cleanse, 60 Gummies",Gummy,60 Gummies,25.89,$0.43,($0.43$0.43/count),2.2,5,false,false,false,false,,200+ bought in past month,hemp gummies THC,https://m.media-amazon.com/images/I/71pXvtPfegL._AC_UL320_.jpg,
B0DSCJCH2M,"Stirling Organic Hemp Oil - 400,000mg Natural Berry Flavor - Enhances Sleep and Helps Reduce Discomfort - THC-Free, Non-GMO, Gluten-Free, High in Omega 3 6 9 - Premium U.S. Hemp Seed Oil",Tincture,,29.99,$29.99,($29.99$29.99/fluid ounce),4.4,5,false,false,false,false,,,hemp gummies THC,https://m.media-amazon.com/images/I/61P2J5leYUL._AC_UL320_.jpg,
B07DX2QKHV,"Organic Hemp Oil Extract Drops, 300mg - Omega Fatty Acids 3 6 9, Non-GMO Ultra-Pure CO2 Extracted",Tincture,,19.99,$19.99,($19.99$19.99/fluid ounce),4.1,4910,false,false,false,false,,,hemp gummies THC,https://m.media-amazon.com/images/I/715VVnOa0sL._AC_UL320_.jpg,
B0G6YH9NWV,"Hemp Oil Drops (2 Pack) High Potency - 2,000,000 Maximum Strength Organic Hemp Tincture for Pain Relief, Sleep, Skin - with C02 Extraction, Vegan, Non-GMO",Tincture,2 Pack,22.99,$11.50,($11.50$11.50/fluid ounce),3.8,23,false,false,false,false,,,hemp gummies THC,https://m.media-amazon.com/images/I/61y7rtGKLNL._AC_UL320_.jpg,
B07V3GSY3Z,"Research Labs Premium Hemp Capsules, 2 Fer 1 Package! 100% Organic All Natural Oil, Worry Nervousness Body Ache Stress Support",Capsule,1 Pack,23.99,$0.20,($0.20$0.20/count),4.2,2435,false,false,false,false,when you subscribeExtra 25% off  when you subscribe,200+ bought in past month,hemp gummies THC,https://m.media-amazon.com/images/I/81yX5a17jyL._AC_UL320_.jpg,
B07YW4NBPC,(2 Pack) 5000mg Organic Cold-Pressed Hemp Oil - Rich in Omega 3-6-9 - Natural Hemp Drops - Made in USA,Tincture,2 Pack,20.85,$10.43,($10.43$10.43/fluid ounce),4.2,468,false,false,false,false,5% off coupon appliedSave 5%  with coupon,50+ bought in past month,hemp gummies THC,https://m.media-amazon.com/images/I/61ht2FvYxiL._AC_UL320_.jpg,
B0CB1SSMPR,"(2-Pack) High Potency Hemp Oil Capsules - 180 Veggie Softgels - 60,000 Maximum Strength, Immune System Support, Focus Calm, Relaxation, Mood, Pure Extract, Organic, Vegan, Non-GMO",Capsule,,24.95,$0.14,($0.14$0.14/count),4.3,69,false,false,false,false,,50+ bought in past month,hemp gummies THC,https://m.media-amazon.com/images/I/71MCre2NIyL._AC_UL320_.jpg,
B0G1RVZV9Z,"(3 Pack) Hemp Oil Drops High Potency Vegan, Non-GMO",Tincture,3 Pack,26.89,$8.96,($8.96$8.96/fluid ounce),4.4,10,false,false,false,false,,,hemp gummies THC,https://m.media-amazon.com/images/I/716KZPQ19GL._AC_UL320_.jpg,
B07VY4WBBK,(2 Pack 10000mg) Hemp Oil - Natural Hemp Seed Extract Hemp Drops Rich in Vitamin & Omega 3 6 9,Tincture,2 Pack,32.89,$16.45,($16.45$16.45/fluid ounce),4.1,354,false,false,false,false,,,hemp gummies THC,https://m.media-amazon.com/images/I/611EE9MSO6L._AC_UL320_.jpg,
B0DLLF4GXX,"Bliss Roots Hemp Gummies with Hemp Seeds Organic Extract, BlissRoots Advanced Formula Gummy with Hemp Oil, Bliss Roots Hemp Gummies Reviews (2 Pack)",Gummy,2 Pack,34.95,$0.29,($0.29$0.29/ounce),2.1,6,false,false,false,false,,,hemp gummies THC,https://m.media-amazon.com/images/I/81e-rsp0TEL._AC_UL320_.jpg,
B0F8PLWMK3,"Bliss Bites Gummies – BlissBites Gummies, Bliss Bites Formula Hemp Gummies All Natural Gummy Reviews (2 Pack - 120 Gummies)",Gummy,2 Pack,29.95,$0.25,($0.25$0.25/count),4.1,33,false,false,false,false,,,hemp gummies THC,https://m.media-amazon.com/images/I/71eICGJdBZL._AC_UL320_.jpg,
B0FC66LD1Q,"Hemp Oil Capsules - 60,000 Maximum Strength, Natural Hemp Oil Extract, Rich in Omega 3, 6, 9 Fatty Acids, Focus, Relaxation, Immune Support - 90 Capsules (2Pack)",Capsule,2Pack,25.99,$0.14,($0.14$0.14/count),4.2,14,false,false,false,false,10% off coupon appliedSave 10%  with coupon,,hemp gummies THC,https://m.media-amazon.com/images/I/71ELZ-lyHHL._AC_UL320_.jpg,
B0C8ZQ7MGS,"Medallion Greens Hemp Gummies (Single, 60 Gummies)",Gummy,60 Gummies,28.99,$0.48,($0.48$0.48/count),3.6,57,false,false,false,false,,,hemp gummies THC,https://m.media-amazon.com/images/I/71m8d9ojPjL._AC_UL320_.jpg,
B0F18BMSCD,"Hemp Oil Drops (3 Pack) High Potency - for Focus Calm, Mood Maximum Strength Natural Hemp Seed Oil - with C02 Extraction, Vegan, Non-GMO Hemp Tincture",Tincture,3 Pack,27.99,$9.33,($9.33$9.33/fluid ounce),4.3,73,false,false,false,false,,,hemp gummies THC,https://m.media-amazon.com/images/I/61xneHtm7WL._AC_UL320_.jpg,
B0D8JYCS7X,"Fortin Gummies - Fortin Hemp Gummies, Fortin Official Formula Hemp Gummies - Natural Hemp Oil Advanced Formulation, Fortin Hemp Gummies Reviews (3 Pack - 180 Gummies)",Gummy,3 Pack,39.95,$0.22,($0.22$0.22/count),3.4,8,false,false,false,false,,,hemp gummies THC,https://m.media-amazon.com/images/I/71NSEAdM58L._AC_UL320_.jpg,
B07PRF567T,"Organic Hemp Oil Extract Drops, 2000mg - Omega Fatty Acids 3 6 9, Non-GMO Ultra-Pure CO2 Extracted",Tincture,,59.99,$30.00,($30.00$30.00/fluid ounce),4.2,2420,false,false,false,false,,50+ bought in past month,hemp gummies THC,https://m.media-amazon.com/images/I/71XXKeetobL._AC_UL320_.jpg,
B0DBHKS9NQ,Hemp Gummies -Natural Raspberry Flavor - Chewable Vitamins for Adults - 30 Gummies - 1 Pack,Gummy,30 Gummies,69.95,$69.95,($69.95$69.95/count),3.2,29,false,false,false,false,,,hemp gummies THC,https://m.media-amazon.com/images/I/615IXxFQ1qL._AC_UL320_.jpg,
B0G3TSWB4M,"(2 Pack) Hemp Oil Organic High Potency - Relieve Good Mood - Hemp Oils Tincture - Natural Hemp Drops for Pain Relief, Sleep, Skin, Vegan, Non-GMO",Tincture,2 Pack,19.19,$9.60,($9.60$9.60/fluid ounce),3.5,9,false,false,false,false,,50+ bought in past month,hemp gummies THC,https://m.media-amazon.com/images/I/710Y9ozbyOL._AC_UL320_.jpg,
B0DLQP7RMJ,"Harmony Glow Gummies - Harmony Glow Hemp Gummies, Harmony Glow Official Formula Hemp Gummies - Natural Hemp Oil Advanced Formulation, Harmony Glow Hemp Gummies Reviews (1 Pack - 60 Gummies)",Gummy,1 Pack,26.95,$0.45,($0.45$0.45/count),3.4,18,false,false,false,false,,,hemp gummies THC,https://m.media-amazon.com/images/I/61omM6aLHvL._AC_UL320_.jpg,
B0F8L44X9S,"Harmony Glow Hemp Gummies - Official Harmony Glow Supplement Hemp Gummys - Maximum Strength, All Natural Support for Overall Health and Wellness Support, HarmonyGlow Health Gummy Reviews (2 Pack)",Gummy,2 Pack,32.95,$0.27,($0.27$0.27/count),5.0,1,false,false,false,false,,,hemp gummies THC,https://m.media-amazon.com/images/I/81NFwH19tpL._AC_UL320_.jpg,
B0F4WXBQZF,"(4-Pack) Premium Hemp Oil High Potency 900,000 Maximum Strength for Sleep Anxiety Relief, Stress, Relaxation, Calming - Natural Hemp Extract, Vegan, Non-GMO - Organic Tincture Drops",Tincture,,28.98,$7.25,($7.25$7.25/fluid ounce),4.6,5,false,false,false,false,,,hemp gummies THC,https://m.media-amazon.com/images/I/71HfKdtHkSL._AC_UL320_.jpg,
B0FCNXKV76,"Harmony Wave Gummies - Official Harmony Wave Supplement Hemp Gummys - Maximum Strength, All Natural Support for Overall Health and Wellness Support, Advanced HarmonyWave Gummy Reviews (3 Pack)",Gummy,3 Pack,59.95,$0.33,($0.33$0.33/count),2.6,3,false,false,false,false,,,hemp gummies THC,https://m.media-amazon.com/images/I/81AVlfdfK8L._AC_UL320_.jpg,
B0FCP1N6CH,"Harmony Wave Gummies - Official Harmony Wave Supplement Hemp Gummys - Maximum Strength, All Natural Support for Overall Health and Wellness Support, Advanced HarmonyWave Gummy Reviews (2 Pack)",Gummy,2 Pack,44.95,$0.37,($0.37$0.37/count),2.8,6,false,false,false,false,,,hemp gummies THC,https://m.media-amazon.com/images/I/81Ne1UrcoRL._AC_UL320_.jpg,
B0CHYD9Y52,Неmр Oil for Dogs Cats - Pure Неmр Drops for Pets Arthritis Pain Аnxiety Rеlief Strеss - Dog Herbal Supplements -Hip Joint Support Calming - Skin Health - Omega 3-6-9 Fatty Acids,Tincture,,15.99,$15.99,($15.99$15.99/fluid ounce),5.0,1,false,false,false,false,20% off coupon appliedSave 20%  with coupon,,hemp gummies THC,https://m.media-amazon.com/images/I/71I5MKw6D9L._AC_UL320_.jpg,
B0F8837V7Q,"Hemp Oil Drops (2 Pack) High Potency - - with C02 Extraction, Vegan, Non-GMO",Tincture,2 Pack,19.80,$9.90,($9.90$9.90/fluid ounce),4.0,22,false,false,false,false,,,hemp gummies THC,https://m.media-amazon.com/images/I/71-LvmQrXtL._AC_UL320_.jpg,
B0FMF98DVZ,"2 Pack Hemp Oil Organic Premium- 100% Natural Hemp Drops Tincture - Hemp Oils with Vegan, Non-GMO Grown",Tincture,2 Pack,25.99,$13.00,($13.00$13.00/fluid ounce),3.9,44,false,false,false,false,,,hemp gummies THC,https://m.media-amazon.com/images/I/61itMxh94fL._AC_UL320_.jpg,
B09FKFTDM2,"VetPro Advanced Calming Aid, Dog Anxiety Treats, Enhanced with Organic Hemp Seed Oil, Veterinarian Formulated Dog Calming Treats",Tincture,,44.95,$44.95,($44.95$44.95/count),4.0,245,false,false,false,false,,,hemp gummies THC,https://m.media-amazon.com/images/I/71f6XYlGpwL._AC_UL320_.jpg,
B0D8JT462W,"Fortin Gummies - Fortin Hemp Gummies, Fortin Official Formula Hemp Gummies - Natural Hemp Oil Advanced Formulation, Fortin Hemp Gummies Reviews (60 Gummies)",Gummy,60 Gummies,19.95,$0.33,($0.33$0.33/count),3.3,9,false,false,false,false,,,hemp gummies THC,https://m.media-amazon.com/images/I/61kZKyiUSqL._AC_UL320_.jpg,
B0DJG5FBT3,"Hemp Gummies Neuropathy Nerve Support Supplement High Potency - Natural Health Pure Extra Strength with Hemp Oil Extract Vegan Edibles for Adults Vegan, Low Sugar, Made in USA",Gummy,,21.99,$0.44,($0.44$0.44/count),4.0,53,false,false,false,false,,,hemp gummies THC,https://m.media-amazon.com/images/I/81rnE6BB24L._AC_UL320_.jpg,
B0CRZY321L,"Bioheal Gummies - Bioheal Hemp Gummies (2 Pack, 120 Gummies)",Gummy,2 Pack,32.99,$0.27,($0.27$0.27/count),3.4,14,false,false,false,false,,,hemp gummies THC,https://m.media-amazon.com/images/I/71-QfN8LMYL._AC_UL320_.jpg,
B0D9HRCBHB,"(2 Pack) Lucanna Farms Gummies, Lucana Farms Hemp Gummies Advanced Formula Maximum Performance Hemp Blend, LucannaFarms Gummies Supplement 25mg per Gummy, 1500mg per Bottle Reviews New (120 Gummies)",Gummy,2 Pack,29.95,$0.25,($0.25$0.25/count),3.8,15,false,false,false,false,,,hemp gummies THC,https://m.media-amazon.com/images/I/81YooTQXjAL._AC_UL320_.jpg,
B0DSLXN71W,"TranquilBlend Gummies – Tranquil Blend Gummies Hemp, Tranquil Blend Formula Hemp Gummies – All Natural Hemp Gummy, TranquilBlend Hemp Gummies Reviews (1 Pack - 60 Gummies)",Gummy,1 Pack,19.95,$0.33,($0.33$0.33/count),3.5,7,false,false,false,false,,,hemp gummies THC,https://m.media-amazon.com/images/I/61FhYuZQJOL._AC_UL320_.jpg,
B0CLVSQ99F,"(2 Pack) Nufarm Gummies - Official Formula - Nufarm Hemp Gummies Premium Blend Hemp Gummies, Nufarm Hemp Advanced Formula 25mg per Gummy 1500mg Per Bottle Big Size Great Taste New Gummy (120 Gummies)",Gummy,2 Pack,39.95,$0.33,($0.33$0.33/count),3.7,41,false,false,false,false,,,hemp gummies THC,https://m.media-amazon.com/images/I/71QsZVBnnUL._AC_UL320_.jpg,
B0F8PLGH1B,"Bliss Bites Gummies – BlissBites Gummies, Bliss Bites Formula Hemp Gummies All Natural Gummy Reviews (1 Pack - 60 Gummies)",Gummy,1 Pack,20.95,$0.35,($0.35$0.35/count),3.3,13,false,false,false,false,,,hemp gummies THC,https://m.media-amazon.com/images/I/61LSOAA2FQL._AC_UL320_.jpg,
B0D1RJWM54,"Green Acre Hemp Gummies - Official Formula - Green Acres Advanced Strength Performance Hemp Blend Formula, Big Size Green Acre Hemp Gomitas with 25mg Hemp, Great Taste 1500mg Per Bottle (60 Gummies)",Gummy,60 Gummies,24.95,$0.42,($0.42$0.42/count),3.7,15,false,false,false,false,,,hemp gummies THC,https://m.media-amazon.com/images/I/71JOFtfliAL._AC_UL320_.jpg,
B0D2LR8VTX,"(2 Pack) Harmony Peak Gummies - Official Formula - Harmony Peak Hemp Gummies Advanced Strength Performance Hemp Blend Formula, Big Size Harmony Peak Gomitas with 25mg Hemp, Great Taste (120 Gummies)",Gummy,2 Pack,29.95,$0.25,($0.25$0.25/count),4.2,5,false,false,false,false,,,hemp gummies THC,https://m.media-amazon.com/images/I/81kBEMOmkZL._AC_UL320_.jpg,
B0CGSGYP1F,"Revolt Hemp Gummies - Revolt Hemp Gummies (Single, 60 Gummies)",Gummy,60 Gummies,37.99,$0.63,($0.63$0.63/count),3.2,4,false,false,false,false,,,hemp gummies THC,https://m.media-amazon.com/images/I/51bQdJQv1fL._AC_UL320_.jpg,
B0DYL52P1Z,Natural Vegan Hemp Gummies - Neuropathy Nerve Pains Calming Extract Gummy Focus & Delicious Relief Fruity Flavors for Daily Support Energy Metabolism,Gummy,,22.99,$0.46,($0.46$0.46/count),4.0,4,false,false,false,false,,,hemp gummies THC,https://m.media-amazon.com/images/I/816Hz7Gu73L._AC_UL320_.jpg,
B0F553CZCR,"GreenVow - Green Vow Gummies (Single, 60 Gummies)",Gummy,60 Gummies,37.95,$0.63,($0.63$0.63/count),3.6,2,false,false,false,false,,,hemp gummies THC,https://m.media-amazon.com/images/I/61NjDudM8kL._AC_UL320_.jpg,
B0CWVWQD9T,"Bliss Bites Gummies - Bliss Bites Hemp Gummies (Single, 60 Gummies)",Gummy,60 Gummies,21.99,$0.37,($0.37$0.37/count),3.8,20,false,false,false,false,,,hemp gummies THC,https://m.media-amazon.com/images/I/611uiOOTDxL._AC_UL320_.jpg,
B0DWV7W218,"Evergreen Hemp Gummies - Ever Green Supplement Hemp Gummies - Maximum Strength, All Natural Overall Health and Wellness Support, Evergreen Health Gummy Reviews (5 Pack)",Gummy,5 Pack,59.95,$0.20,($0.20$0.20/count),2.9,2,false,false,false,false,,,hemp gummies THC,https://m.media-amazon.com/images/I/816fvLxD6sL._AC_UL320_.jpg,
B0D2LQ98X7,"Harmony Peak Gummies - Official Formula - Harmony Peak Hemp Gummies Advanced Strength Performance Hemp Blend Formula, Big Size Harmony Peak Gomitas with 25mg Hemp Extract, Great Taste (60 Gummies)",Gummy,60 Gummies,19.95,$0.33,($0.33$0.33/count),,,false,false,false,false,,,hemp gummies THC,https://m.media-amazon.com/images/I/71MLvZ-QtSL._AC_UL320_.jpg,
B0D362Y9QK,"Zen Leaf Hemp Gummies - with Hemp Seed Extract ZenLeaf Hemp Gummies Tinnitus Herbal Supplement, Health and Wellness Support, All Natural Zen Leaf Hemp Gummy (1 Pack - 60 Gummies)",Gummy,1 Pack,39.95,$0.67,($0.67$0.67/count),3.0,4,false,false,false,false,,,hemp gummies THC,https://m.media-amazon.com/images/I/617U6g+7HuL._AC_UL320_.jpg,
B0FCNVLXBY,"Harmony Wave Gummies - Official Harmony Wave Supplement Hemp Gummys - Maximum Strength, All Natural Support for Overall Health and Wellness Support, Advanced HarmonyWave Gummy Reviews (5 Pack)",Gummy,5 Pack,72.95,$0.24,($0.24$0.24/count),5.0,1,false,false,false,false,,,hemp gummies THC,https://m.media-amazon.com/images/I/81iqN-3ycKL._AC_UL320_.jpg,
B0DYLB583H,Organic Hemp Gummies Natural Pure Hemp Oil Extract - Performance High Potency Extra Strength ed Edible Vegan Prime Vigor XL Made in USA,Gummy,,22.99,$0.46,($0.46$0.46/count),3.1,11,false,false,false,false,,,hemp gummies THC,https://m.media-amazon.com/images/I/81pqbglLLTL._AC_UL320_.jpg,
B0CLM6QTJC,"(3 Pack) Vigorvita Gummies - Official Formula - Vigor Vita Gummies Extra Strength Gummy with Hemp Extract, Vigorvita Gummies for Health, Vitgorvital Gummies, Vigorvitagummies New 2023 (180 Gummies)",Gummy,3 Pack,49.95,$0.28,($0.28$0.28/count),3.6,29,false,false,false,false,,,hemp gummies THC,https://m.media-amazon.com/images/I/81yOkp3X5VL._AC_UL320_.jpg,
B0DMTX4VFZ,Organic Hemp Gummies Natural Pure Hemp Oil Extract - Performance Vitamin B2 Extra Strength ed Edible Prime Vital Grow XL for Men Supplement Made in USA,Gummy,,21.99,$0.44,($0.44$0.44/count),4.6,16,false,false,false,false,,,hemp gummies THC,https://m.media-amazon.com/images/I/71n9g2bQt8L._AC_UL320_.jpg,
B0D79PVKBQ,"Herbal Harmony Gummies for Men and Women - Herbal Harmony Gummy, Herbal Harmony Infused with Hemp Extract, Herbal Harmony Natural Hemp Supplement Reviews (1 Pack - 60 Gummies)",Gummy,1 Pack,19.95,$0.33,($0.33$0.33/count),5.0,2,false,false,false,false,,,hemp gummies THC,https://m.media-amazon.com/images/I/61FFmaZJyeL._AC_UL320_.jpg,
B0DF414XQ6,"Tetra Bliss Gummies - TetraBliss Hemp Gummies, Tetra Bliss Official Formula Hemp Gummies - Natural Hemp Oil Advanced Formulation, Bliss Tetra Hemp Gummies Reviews (3 Pack - 180 Gummies)",Gummy,3 Pack,42.95,$0.24,($0.24$0.24/count),3.2,3,false,false,false,false,5% off coupon appliedSave 5%  with coupon,,hemp gummies THC,https://m.media-amazon.com/images/I/71bmWehvCML._AC_UL320_.jpg,
B0D27NTJQJ,"(3 Pack) Bloom Hemp Gummies - Official Formula - Bloom Gummies with Hemp Advanced Strength Performance Hemp Blend Formula, Big Size Bloom Gomitas with 25mg Hemp Extract, Great Taste (180 Gummies)",Gummy,3 Pack,54.95,$0.92,($0.92$0.92/count),3.7,21,false,false,false,false,,,hemp gummies THC,https://m.media-amazon.com/images/I/811ZVeDp6WL._AC_UL320_.jpg,
B0C5QDRG7Y,"(5 Pack) Regen Hemp Gummies - Official Formula - Regen Gummies Extra Strength Formula 25mg Per Gummy, 1500mg Per Bottle, Great Taste Big Size Assorted Flavor Gummy Bear Regen Gummys (300 Gummies)",Gummy,5 Pack,79.95,$1.33,($1.33$1.33/count),4.0,6,false,false,false,false,,,hemp gummies THC,https://m.media-amazon.com/images/I/81Act9ltZhL._AC_UL320_.jpg,
B0FZHXYXYY,Omega Gummies 2 Packs 1129,Gummy,2 Pack,31.99,$0.20,($0.20$0.20/count),3.5,10,false,false,false,false,,,hemp gummies THC,https://m.media-amazon.com/images/I/713NOCvC8IL._AC_UL320_.jpg,
B0F62WQ2PZ,Omega Gummies 3 Packs,Gummy,3 Pack,35.99,$0.15,($0.15$0.15/count),4.1,52,false,false,false,false,,,hemp gummies THC,https://m.media-amazon.com/images/I/614WXxH2mZL._AC_UL320_.jpg,
B0G3PDG1G9,(2-Pack) Hemp Oil Drops High Potency Maximum Strength Natural Hemp Oil - Organic Hemp Oils Extract Relieve Good Mood,Tincture,,22.99,$11.50,($11.50$11.50/fluid ounce),4.1,14,false,false,false,false,,,hemp gummies THC,https://m.media-amazon.com/images/I/71nnHpDbgmL._AC_UL320_.jpg,
B0D2LLKH3R,"(5 Pack) Harmony Peak Gummies - Official Formula - Harmony Peak Hemp Gummies Advanced Strength Performance Hemp Blend Formula, Big Size Harmony Peak Gomitas with 25mg Hemp, Great Taste (300 Gummies)",Gummy,5 Pack,69.95,$1.17,($1.17$1.17/count),5.0,1,false,false,false,false,,,hemp gummies THC,https://m.media-amazon.com/images/I/81QAVuLMlUL._AC_UL320_.jpg,
B0BYDK1D81,"Best Tasting Hemp Gummie Bears 35,000 MG Natural, Muscle Relax, Sleep Calm, Stress Relief NO THC Natural Vitamins USA",,,,,,3.9,29,false,false,false,false,,,hemp gummies THC,https://m.media-amazon.com/images/I/51lVeO2ibNL._AC_UL320_.jpg,
B0BXXBWNKP,": Premium High Potency Hemp Gummy Bears and Natural Vitamins,Muscle Relax, Sleep Calm, Stress Relief USA",Gummy,,,,,3.4,15,false,false,false,false,,,hemp gummies THC,https://m.media-amazon.com/images/I/51lVeO2ibNL._AC_UL320_.jpg,
B0D361PDHW,"Zen Leaf Hemp Gummies - with Hemp Seed Extract ZenLeaf Hemp Gummies Tinnitus Herbal Supplement, Health and Wellness Support, All Natural Zen Leaf Hemp Gummy (3 Pack - 180 Gummies)",Gummy,3 Pack,79.95,$0.44,($0.44$0.44/count),3.0,3,false,false,false,false,,,hemp gummies THC,https://m.media-amazon.com/images/I/71DT4AvK1cL._AC_UL320_.jpg,
B09B1CLZ6G,Ultra High Strength Hemp Oil Supplement for Body & Mind Benefits - USDA Certified Organic - Natural Flavor - 2500mg - Pure Hemp (1oz/30ml) 60 Servings - Calming Stress Relief,Tincture,,64.99,$64.99,($64.99$64.99/fluid ounce),4.6,13,false,false,false,false,25% off coupon appliedSave 25%  with coupon,,hemp gummies THC,https://m.media-amazon.com/images/I/51VGWAqeJ1L._AC_UL320_.jpg,
B0FPMKHGPK,"Vitamatic Valerian Root & Chamomile Gummies – Plant-Based Botanical Extract – Mixed Berry Flavor – Vegan, Non-GMO, Gluten-Free – Herbal Supplement – 60 Count",Gummy,60 Count,14.99,$0.25,($0.25$0.25/count),4.3,87,false,false,false,false,when you subscribeExtra 35% off  when you subscribe,400+ bought in past month,CBD THC gummies,https://m.media-amazon.com/images/I/71LsCNOnKeL._AC_UL320_.jpg,
B0DDHG4WTW,"17-in-1 Brain Supplement for Memory and Focus - Nootropic Brain Supplement for Concentration, Clarity, Energy & Focus - Natural Caffeine Blend with Vitamins, Amino Acids & Herbal Extracts - 60 Tablets",,,21.99,$0.37,($0.37$0.37/count),4.2,281,false,false,false,false,,600+ bought in past month,CBD THC gummies,https://m.media-amazon.com/images/I/71VJFYRZglL._AC_UL320_.jpg,
B0FM3YGT4B,"Melatonin Free Sleep Gummies for Adults with Magnesium, Valerian Root, 5-HTP & Herbal Blend - Natural Sleep Aid Supplements - Non-Habit Forming, Sugar Free, Strawberry Flavor, 60 Count (1)",Gummy,60 Count,19.99,$0.33,($0.33$0.33/count),3.8,39,false,false,false,false,,600+ bought in past month,CBD THC gummies,https://m.media-amazon.com/images/I/71ZOJehpu1L._AC_UL320_.jpg,
B0FHQHG8HG,"CalmCo Adult Sleep Aid Chewable Gels – Nighttime Sleep Support with Diphenhydramine HCl 25 mg, Non-Habit Forming, Promotes Better Sleep and Helps You Fall Asleep Faster, Fantasy Fruit Flavor, 30 Count",,30 Count,26.95,$0.90,($0.90$0.90/count),5.0,1,false,false,false,false,,,CBD THC gummies,https://m.media-amazon.com/images/I/719VSXYyjcL._AC_UL320_.jpg,
B0F4RF4P3H,"HOOLOO Hemp Gummies for Deep Bedtime Support - 4,500,000MG 2 Packs 6 Fruity Flavors Edibles for Adults - Made in USA",Gummy,2 Pack,29.98,$0.30,($0.30$0.30/count),4.3,21,false,false,false,false,,200+ bought in past month,CBD THC gummies,https://m.media-amazon.com/images/I/81VcyxefrFL._AC_UL320_.jpg,
B09JMJ554Y,"Vitamatic Melatonin 20mg Gummies for Adults, 30 Servings - 60 Count - Non-Habit Forming Supplement",Gummy,60 Count,9.98,$0.17,($0.17$0.17/count),4.5,2476,false,false,false,false,,2K+ bought in past month,CBD THC gummies,https://m.media-amazon.com/images/I/71wupTbOpfL._AC_UL320_.jpg,
B0F2ZFPYFL,"NOKT Sleep Gummies - Tart Cherry & Vegan Melatonin, Sugar-Free, Gluten-Free, Nutritional Supplement, 30 Gummies, Tart Cherry Flavor, Gummy Form, Deep Restorative Sleep Support",Gummy,30 Gummies,31.20,$1.04,($1.04$1.04/count),3.6,107,false,false,false,false,,500+ bought in past month,CBD THC gummies,https://m.media-amazon.com/images/I/71xc1I0bNQL._AC_UL320_.jpg,
B0F8DG1S48,"LITTLE DEATH Deep Sleep Gummies, 60 Pcs. – 50 mg. Magnesium, Ashwagandha, Chamomile, Vitamin B6 – Raspberry Flavor – Melatonin Free, Sugar Free, Vegan, Made in USA",Gummy,60 Pcs,31.99,$0.53,($0.53$0.53/count),3.6,73,false,false,false,false,,300+ bought in past month,CBD THC gummies,https://m.media-amazon.com/images/I/91390Jgc2HL._AC_UL320_.jpg,
B0BTKX7NWD,Vitamatic Sugar Free Melatonin 60 mg - 60 Vegetarian Gummies - Non-Habit Forming Supplement,Gummy,,19.99,$0.33,($0.33$0.33/count),4.5,1275,false,false,false,false,when you subscribeExtra 25% off  when you subscribe,3K+ bought in past month,CBD THC gummies,https://m.media-amazon.com/images/I/71Itxn6NywL._AC_UL320_.jpg,
B09XN84YH9,"CBD Gummies | 18"" X 48"" Banner | Heavy Duty 13oz. Outdoor Vinyl Single Sided with Grommets | Made in The USA",Gummy,,22.87,,,,,false,false,false,false,,,CBD THC gummies,https://m.media-amazon.com/images/I/51kXu2W3ygL._AC_UL320_.jpg,
B0FBRGB4T6,Omega 3-6-9 Gummies Organic Vegan 80 Count,Gummy,9 Gummies,21.99,$0.26,($0.26$0.26/count),3.4,24,false,false,false,false,,,CBD THC gummies,https://m.media-amazon.com/images/I/81wzJYRXjlL._AC_UL320_.jpg,
B0DLYH3RPJ,"Bliss Roots Gummies - Official Formula - Bliss Roots Hemp Gummies, BlissRoots Gummies Maximum Strength Vitamin Supplement Gummy, Bliss Roots Hemp Advanced Support, USA 1500mg Per Bottle (60 Gummies)",Gummy,60 Gummies,27.95,$0.47,($0.47$0.47/count),3.6,21,false,false,false,false,,,CBD THC gummies,https://m.media-amazon.com/images/I/712sUpdC5nL._AC_UL320_.jpg,
B0DXKSS8NR,Natural Omega Gummies Organic Vegan 80 Count,Gummy,80 Count,21.99,$0.07,($0.07$0.07/count),3.6,22,false,false,false,false,,,CBD THC gummies,https://m.media-amazon.com/images/I/81wzJYRXjlL._AC_UL320_.jpg,
B0D771G7GL,"(5 Pack) Calmwell Hemp Gummies - Official Formula - Calmwell Gummies Extra Strength, Maximum Performance Hemp Blend, Calm Well Gummies Great Taste 25mg Per Gummy 1500mg Per Bottle New (300 Gummies)",Gummy,5 Pack,27.95,$0.09,($0.09$0.09/count),,,false,false,false,false,,,CBD THC gummies,https://m.media-amazon.com/images/I/81uJ44vHWAL._AC_UL320_.jpg,
B09XN6LK65,"CBD Products for Pets | 18"" X 48"" Banner | Heavy Duty 13oz. Outdoor Vinyl Single Sided with Grommets | Made in The USA",,,22.39,,,,,false,false,false,false,,,CBD THC gummies,https://m.media-amazon.com/images/I/51QY+OXFZwL._AC_UL320_.jpg,
B0D2LQYSGD,"(3 Pack) Harmony Peak Gummies - Official Formula - Harmony Peak Hemp Gummies Advanced Strength Performance Hemp Blend Formula, Big Size Harmony Peak Gomitas with 25mg Hemp, Great Taste (180 Gummies)",Gummy,3 Pack,39.95,$0.22,($0.22$0.22/count),4.2,5,false,false,false,false,,,CBD THC gummies,https://m.media-amazon.com/images/I/81ee1WpHJ7L._AC_UL320_.jpg,
B088CNZFVM,Organic Hemp Oil 3500mg - Ultra Premium Hemp Oil Drops 3500mg - Natural Hemp Oil Extract Tincture - Non-GMO Ultra-Pure CO2 Extracted Drops - Omega Fatty Acids 3 6 9 - Organically Grown & Made in USA,Tincture,,44.87,$44.87,($44.87$44.87/fluid ounce),4.1,158,false,false,false,false,10% off coupon appliedSave 10%  with coupon,100+ bought in past month,hemp derived THC edibles,https://m.media-amazon.com/images/I/811et7MkvoS._AC_UL320_.jpg,
B0GQFCSY6Q,"Hemp Oil Drops (2 Pack) High Potency - 2,000,000 Maximum Strength Organic Hemp Tincture for Pain Relief, Sleep, Skin - with C02 Extraction, Vegan, Non-GMO",Tincture,2 Pack,19.99,$10.00,($10.00$10.00/fluid ounce),4.8,29,false,false,false,false,,100+ bought in past month,hemp derived THC edibles,https://m.media-amazon.com/images/I/71MIPCl3o2L._AC_UL320_.jpg,
