asin,title,formFactor,count,price,listPrice,unitPrice,rating,reviewCount,isBestSeller,isAmazonChoice,isSponsored,isPrime,coupon,boughtPastMonth,searchQuery,image,url
B0GTLNMTDM,"2 Packs Hemp Gummies for Sleep, Pain, Anxiety Relaxation and Peace, High Potency Edible Gummies Extra Strength Organic Hemp Oil Extract Vegan Bear Gummy - 160 Counts Candy",Gummy,2 Pack,26.99,$0.17,($0.17$0.17/count),5.0,30,false,false,false,false,20% off coupon appliedSave 20%  with coupon,,THC gummies,https://m.media-amazon.com/images/I/71qwEhI73VL._AC_UL320_.jpg,
B0FSMJRDK4,"Hemp Gummies - Zero Sugar - Extra Strength for Peace & Relaxation - Infused with Hemp Oil, Ashwagandha, L-Theanine - Tasty Relaxation Supplement - Natural Relief - 90 Ct - Formulated in USA",Gummy,90 Ct,16.95,$0.19,($0.19$0.19/count),4.5,35,false,false,false,false,,800+ bought in past month,THC gummies,https://m.media-amazon.com/images/I/816FIwulsKL._AC_UL320_.jpg,
B0FSRQ1WQJ,"Hempgummies Extra Strength for Adults - Blueberry Grape Natural Juice Vitamins, Omega 3 - Chewable Gummy for Deep Bedtimes, Focus, Unwind, Made in USA",Gummy,,5.99,$0.12,($0.12$0.12/count),3.4,43,false,false,false,false,,300+ bought in past month,THC gummies,https://m.media-amazon.com/images/I/819-HKrCzsL._AC_UL320_.jpg,
B0F5443HDY,"HOOLOO Hemp Gummies for Deep Bedtimes, Unwind, Focus - 6 Fruity Flavors Big Cubes Gummy Infused Vitamins Omega 3 - Extra Stength 4,500,000mg for Adults - Made in USA",Gummy,,18.48,$0.37,($0.37$0.37/count),3.9,146,false,false,false,false,,600+ bought in past month,THC gummies,https://m.media-amazon.com/images/I/81V4h9sIOlL._AC_UL320_.jpg,
B087Z9KV7F,"Hemp Gummies 750,000mg Premium Organic Sugar-Free Natural Health Support High Potency Rich in Vitamins B E C D Omega 3 6 9 Super Gummy Bears",Gummy,,19.98,$0.48,($0.48$0.48/count),4.0,1202,false,false,false,false,50% off coupon appliedSave 50%  with coupon,300+ bought in past month,THC gummies,https://m.media-amazon.com/images/I/814HFiw+HaL._AC_UL320_.jpg,
B0DQ2JYBBF,"Mushroom Gummies Supplement 12 in 1 - High Grade Blend for Adults with Lions Mane, Reishi, Cordyceps, & Chaga Mushroom Complex Gummy, Memory & Immune Support & Nootropic Brain Supplements - 60 Gummies",Gummy,60 Gummies,9.82,$0.16,($0.16$0.16/count),4.4,138,false,false,false,false,when you subscribeExtra $1.00 off  when you subscribe,700+ bought in past month,THC gummies,https://m.media-amazon.com/images/I/71NtAzOOSvL._AC_UL320_.jpg,
B0GRGGM4SH,"Hemp Gummies for Sleep, Anxiety, Pain High Potency Extra Strength Hemp Oil Extract Organic Edible Gummy Supplement for Adult Gummy",Gummy,,15.99,$0.20,($0.20$0.20/count),5.0,23,false,false,false,false,20% off coupon appliedSave 20%  with coupon,,THC gummies,https://m.media-amazon.com/images/I/71nGG5+XcsL._AC_UL320_.jpg,
B09JWW7KL4,"Hemp Gummies Edibles-Delicious Butterflies Gummy Bears-Fresh Fruity Flavors-Natural Candy Peace and Relaxation-for Sleep, Calm, Relax-Made in USA-100 Count",Gummy,100 Count,29.99,$0.30,($0.30$0.30/count),3.9,1411,false,false,false,false,when you subscribeExtra 40% off  when you subscribe,1K+ bought in past month,THC gummies,https://m.media-amazon.com/images/I/812Oe3oAMiL._AC_UL320_.jpg,
B0GPHPP361,Hemp Gummies for Sleep Anxiety Pain Inflammation Relief Edible with Omega & Vitamin Premium Fruity Flavors-Natural Candy High Potency 160 Count 2 Pack,Gummy,160 Count,23.29,$0.15,($0.15$0.15/count),5.0,28,false,false,false,false,,50+ bought in past month,THC gummies,https://m.media-amazon.com/images/I/71UqQ5DgrAL._AC_UL320_.jpg,
B0F53R29YS,"HOOLOO Hemp Gummies for Adults, 6 Fruity Flavors for Deep Bedtime, Relax, Hemp Gummy Infused Vitamins and Omega 3, Made in USA",Gummy,,16.48,$0.33,($0.33$0.33/count),3.9,374,false,false,false,false,when you subscribeExtra 10% off  when you subscribe,1K+ bought in past month,THC gummies,https://m.media-amazon.com/images/I/81iaIuZPAdL._AC_UL320_.jpg,
B0DYQ1879L,Potent Hemp Gummies | 60 Count | Pure Clean Colorado Hemp | Calm Gummies for Worriedness & Sleep,Gummy,60 Count,9.99,$0.17,($0.17$0.17/count),3.6,189,false,false,false,false,,100+ bought in past month,THC gummies,https://m.media-amazon.com/images/I/71KKyeMtYcL._AC_UL320_.jpg,
B01M1HYRNJ,"OLLY Goodbye Stress Gummy, GABA, L-Theanine, Lemon Balm, Stress Relief Supplement, Berry - 42 Count",Gummy,42 Count,11.47,$0.27,($0.27$0.27/count),4.4,13907,false,false,false,false,,10K+ bought in past month,THC gummies,https://m.media-amazon.com/images/I/71IhID2A4pL._AC_UL320_.jpg,
B0G3M3QR3D,Hemp Gummies for Sleep-Calm Relaxing Night Support-Made in USA-90 Count Gummy Bear Edibles Candy,Gummy,90 Count,16.99,$0.19,($0.19$0.19/count),4.1,69,false,false,false,false,when you subscribeExtra 40% off  when you subscribe,300+ bought in past month,THC gummies,https://m.media-amazon.com/images/I/819hAcSSljL._AC_UL320_.jpg,
B0GRY15XBZ,"3 Packs Hemp Gummies for Sleep, Pain, Anxiety Relaxation and Peace, High Potency Edible Gummies Extra Strength Organic Hemp Oil Extract Vegan Bear Gummy - 240 Counts Candy",Gummy,3 Pack,32.99,$0.14,($0.14$0.14/count),5.0,44,false,false,false,false,20% off coupon appliedSave 20%  with coupon,,THC gummies,https://m.media-amazon.com/images/I/71oSvG1ZfxL._AC_UL320_.jpg,
B0D962V3G5,"Next-Gen Mushroom Gummies with Ashwagandha and L Theanine - 10x Mushroom Supplement with Shilajit - Mushroom Nootropic Lion’s Mane Gummies - Immune, Brain Support & Chill Mushroom Complex Gummy",Gummy,,23.99,$0.27,($0.27$0.27/count),4.0,142,false,false,false,false,when you subscribeExtra 10% off  when you subscribe,200+ bought in past month,THC gummies,https://m.media-amazon.com/images/I/81qpJOE1jWL._AC_UL320_.jpg,
B0GQ8X6RT8,"Hemp Gummies High Potency for Pain, Sleep, Anxiety - Advanced Extra Strength Supplement with Pure Hemp Oil Extract - Best Hеmp Gummy for Adults",Gummy,,16.99,$0.21,($0.21$0.21/count),3.8,8,false,false,false,false,10% off coupon appliedSave 10%  with coupon,,THC gummies,https://m.media-amazon.com/images/I/71c+2FBR9WL._AC_UL320_.jpg,
B08NLHCNJY,Hemp Gummies - Made in USA - 100% Natural and Tasty Fruit Flavors - 100ct,Gummy,100ct,26.95,$0.27,($0.27$0.27/count),4.2,1536,false,false,false,false,,1K+ bought in past month,THC gummies,https://m.media-amazon.com/images/I/713dgGtDjAL._AC_UL320_.jpg,
B0GQS2131J,"(1 Packs) Hemp Gummies Advanced for Pain, Sleep, Anxiety - High Potency Pure Organic Hеmp Oil Extract Supplement - 100% Natural Extra Strength Hemp Gummy - Vegan Non-GMO",Gummy,1 Pack,16.99,$0.21,($0.21$0.21/count),3.9,26,false,false,false,false,20% off coupon appliedSave 20%  with coupon,,THC gummies,https://m.media-amazon.com/images/I/71fOcjgV+9L._AC_UL320_.jpg,
B0874QHJPN,AFXMATE Hemp Gummies 50000 mg Fruit Flavored Gummy (90 Gummies),Gummy,90 Gummies,18.98,$0.21,($0.21$0.21/count),3.8,3780,false,false,false,false,when you subscribeExtra 10% off  when you subscribe,100+ bought in past month,THC gummies,https://m.media-amazon.com/images/I/71vh0HGD2aL._AC_UL320_.jpg,
B0FS7G5KLC,"(4 Packs) Hemp Gummies High Potency for Sleep, Pain, Anxiety- Pure Extra Strength Organic Hеmp Oil Gummies - 100% Natural Bear Hemp Gummy for Adults",Gummy,4 Pack,37.99,$0.12,($0.12$0.12/count),3.8,37,false,false,false,false,20% off coupon appliedSave 20%  with coupon,400+ bought in past month,THC gummies,https://m.media-amazon.com/images/I/71CKjAskNgL._AC_UL320_.jpg,
B092L9WWC8,"OLLY Hello Happy Gummy Worms, Mood Balance Support, Vitamin D, Saffron, Adult Chewable Supplement, Tropical Zing - 60 Count",Gummy,60 Count,16.97,$0.28,($0.28$0.28/count),4.4,6488,false,false,false,false,,10K+ bought in past month,THC gummies,https://m.media-amazon.com/images/I/71o4sQ6dH+L._AC_UL320_.jpg,
B09XHJ2JV6,"3 Packs Organic Hemp Gummies 7,500,000 High Strength - High Potency Hemp Oil Infused Gummiеs - Natural Hemp Candy Supplements - 240 Gummiеs",Gummy,3 Pack,37.99,$0.16,($0.16$0.16/count),4.0,1189,false,false,false,false,when you subscribeExtra 30% off  when you subscribe,200+ bought in past month,THC gummies,https://m.media-amazon.com/images/I/71y6HOCfOTL._AC_UL320_.jpg,
B0CPCR5QZZ,"Hemp Gummies Advanced Extra Strength- High Potency Natural Hemp Oil Extract Gummy, Great for Peace & Relaxation,Naturals Fruit Flavors,Made in USA",Gummy,,22.89,$0.38,($0.38$0.38/count),4.0,359,false,false,false,false,,700+ bought in past month,THC gummies,https://m.media-amazon.com/images/I/71FPJvfeQ0L._AC_UL320_.jpg,
B0CB79FWKZ,"OLLY Max Strength Sleep Gummy, 10mg Melatonin, L-Theanine, Chamomile, Lemon Balm, Sugar Free, Vegetarian Sleep Aid, Strawberry - 50 Count",Gummy,50 Count,14.78,$0.30,($0.30$0.30/count),4.5,2353,false,false,false,false,,10K+ bought in past month,THC gummies,https://m.media-amazon.com/images/I/71xChE3dB4L._AC_UL320_.jpg,
B0BV7GKYF9,"Plant People WonderCalm Mushroom Gummies - Natural Ashwagandha Supplement to Ease Stress & Boost Mood for Adults Without Sugar, Gluten or Artificial Colors, Vegan-Friendly, Peach Flavor, 60 Count",Gummy,60 Count,34.99,$0.58,($0.58$0.58/count),4.5,704,false,false,false,false,when you subscribeExtra 20% off  when you subscribe,1K+ bought in past month,THC gummies,https://m.media-amazon.com/images/I/71FIAec3uoL._AC_UL320_.jpg,
B0GQ3BY8FH,"(1 Packs) Hemp Gummies for Sleep, Pain, Anxiety, Peace & Relaxation - High Potency Natural Hеmp Oil Infused Gummies - Natural Fruity Bear Hemp Gummy for Adults Vegan",Gummy,1 Pack,16.29,$0.20,($0.20$0.20/count),3.9,14,false,false,false,false,,300+ bought in past month,THC gummies,https://m.media-amazon.com/images/I/61mFaD-UrIL._AC_UL320_.jpg,
B07V8LTDLG,Hemp Gummies - Advanced Gummies - Relaxing Gummy with Hemp Oil [2-Pack],Gummy,,32.95,$0.27,($0.27$0.27/count),3.9,974,false,false,false,false,when you subscribeExtra 20% off  when you subscribe,100+ bought in past month,THC gummies,https://m.media-amazon.com/images/I/710oVQhYqPL._AC_UL320_.jpg,
B0DSCKR2QQ,"Hemp Gummies Edibles Calm Sleep-Support Peace and Relaxation-Hemp Oil Gummy Bears Candy, Tasty Fruity Confection Flavors-Made in USA-90 Ct.",Gummy,90 Ct,29.99,$0.33,($0.33$0.33/count),3.8,223,false,false,false,false,when you subscribeExtra 40% off  when you subscribe,100+ bought in past month,THC gummies,https://m.media-amazon.com/images/I/81CNC05ocnL._AC_UL320_.jpg,
B09JNK4TND,"(3 Pack) High Potency Hemp Gummies 600,000 Extra Strength - Stress, Sleep, Mood, Calming, Focus, Relaxation Supplements, 100% Natural Hemp Oil Extract Infused Gummies, Vegan, Non-GMO, Gluten-Free",Gummy,3 Pack,32.99,$0.18,($0.18$0.18/count),4.0,429,false,false,false,false,,200+ bought in past month,THC gummies,https://m.media-amazon.com/images/I/81cW0m9KTAL._AC_UL320_.jpg,
B0DLR2CPFK,"Shrumfuzed - Proprietary Nootropic Gummy 8000mg - Lion's Mane, Reishi, Chaga, and Cordycep Nootropic Mushroom Blend (10, Assorted)",Gummy,,35.00,$3.50,($3.50$3.50/count),4.0,78,false,false,false,false,,300+ bought in past month,THC gummies,https://m.media-amazon.com/images/I/61GHe5QXQ7L._AC_UL320_.jpg,
B0GJ7GL7ZG,"Hemp Gummies for Sleep and Relaxation-Fruity Gummy Bears Candy Edibles, Hemp Oil Infused-Made in USA-96 Bears",Gummy,,17.99,$0.19,($0.19$0.19/count),4.2,26,false,false,false,false,when you subscribeExtra 40% off  when you subscribe,100+ bought in past month,THC gummies,https://m.media-amazon.com/images/I/81XFDz0ylNL._AC_UL320_.jpg,
B0GMVW3BYZ,"Hemp Gummies High Potency Extra Strength Hemp Oil Extract Organic Edible Gummy Supplement for Adult Gummy for Sleep, Pain, Anxiety",Gummy,,21.99,$0.27,($0.27$0.27/count),3.6,44,false,false,false,false,10% off coupon appliedSave 10%  with coupon,400+ bought in past month,THC gummies,https://m.media-amazon.com/images/I/71ooqDMrK4L._AC_UL320_.jpg,
B0G3M66SY4,Hemp Gummies for Sleep Calm Night Peaceful Day-Fruity Gummy Bear Edibles Candy-Made in USA-100 Count,Gummy,100 Count,19.99,$0.20,($0.20$0.20/count),4.0,81,false,false,false,false,when you subscribeExtra 40% off  when you subscribe,200+ bought in past month,THC gummies,https://m.media-amazon.com/images/I/81K+jt8nVvL._AC_UL320_.jpg,
B0FSZTRMP3,"(1 Packs) Hemp Gummies High Potency for Sleep, Pain, Anxiety- Pure Extra Strength Organic Hеmp Oil Gummies - 100% Natural Bear Hemp Gummy for Adults",Gummy,1 Pack,21.99,$0.27,($0.27$0.27/count),3.9,11,false,false,false,false,,,THC gummies,https://m.media-amazon.com/images/I/615ZLUfwVlL._AC_UL320_.jpg,
B0DNJFXDTN,"2 Pack Hemp Gummies for Sleep, Relaxation - Extra Strength with Magnesium & Vitamins - High Potency Natural Hemp Oil Extract Supplement, Vegan Gummy Bears,",Gummy,2 Pack,29.99,$0.25,($0.25$0.25/count),3.9,336,false,false,false,false,20% off coupon appliedSave 20%  with coupon,600+ bought in past month,THC gummies,https://m.media-amazon.com/images/I/71eI49D8NgL._AC_UL320_.jpg,
B0C5C48H7M,"Shameless Snacks - Healthy Low Calorie Snacks, Low Carb Keto Gummies (Gluten Free Candy) - 6 Pack Super Variety Pack",Gummy,6 Pack,19.19,$1.78,($1.78$1.78/ounce),4.3,4605,false,true,false,false,,10K+ bought in past month,THC gummies,https://m.media-amazon.com/images/I/81+YaLNRzlL._AC_UL320_.jpg,
B0G4MX3V45,"Hemp Gummies for Pain, Sleep, Anxiety - High Potency Pure Organic Hеmp Oil Extract Supplement - 100% Natural Hemp Gummy - Vegan Non-GMO",Gummy,,17.99,$0.22,($0.22$0.22/count),3.8,53,false,false,false,false,,100+ bought in past month,THC gummies,https://m.media-amazon.com/images/I/61OsHoWYt4L._AC_UL320_.jpg,
B0CTR2KRGC,"Naturals Fruit Hemp Gummies 1,500,000mg High Strength - Natural Hemp Oil Infused Gummies Great for Peace & Relaxation,America's #1 Favorite Hemp Gummy Brand - 90 Gummies",Gummy,90 Gummies,19.99,$0.22,($0.22$0.22/count),4.1,776,false,false,false,false,,700+ bought in past month,THC gummies,https://m.media-amazon.com/images/I/71cBqREz11L._AC_UL320_.jpg,
B0CNQDYFH6,"Gruns Adult Super Greens Multivitamin Gummies, Superfood Gummy Vitamins for Women and Men with Spirulina, Chlorella, Adaptogens & Prebiotic Fiber for Digestive Health (28 Count)",Gummy,28 Count,67.00,$2.39,($2.39$2.39/count),4.4,4832,false,false,false,false,when you subscribeExtra 15% off  when you subscribe,50K+ bought in past month,THC gummies,https://m.media-amazon.com/images/I/81xGiy1OjnL._AC_UL320_.jpg,
B0GNCVF9WQ,"Hemp Gummies Advanced Extra Strength for Pain, Sleep, Anxiety - 1 Pack High Potency Pure Organic Hеmp Oil Extract Supplement - Natural Hemp Gummy - Vegan Non-GMO",Gummy,1 Pack,17.99,$0.22,($0.22$0.22/count),2.9,18,false,false,false,false,,300+ bought in past month,THC gummies,https://m.media-amazon.com/images/I/61OsHoWYt4L._AC_UL320_.jpg,
B0DY16Q9CC,"Hemp Gummies Advanced Extra Strength for Sleep Pain Anxiety - High Potency Natural Hemp Oil Infused Gummies, Hemp Gummy for Adults-4 Packs",Gummy,4 Pack,39.99,$0.12,($0.12$0.12/count),4.4,147,false,false,false,false,,100+ bought in past month,THC gummies,https://m.media-amazon.com/images/I/71GcTrLm2oL._AC_UL320_.jpg,
B0GM43NSB3,"Hemp Gummies High Potency for Sleep, Pain, Anxiety - Pure Extra Strength Organic Hеmp Oil Gummies (1 Packs)",Gummy,1 Pack,17.99,$0.22,($0.22$0.22/count),3.8,17,false,false,false,false,,,THC gummies,https://m.media-amazon.com/images/I/615ZLUfwVlL._AC_UL320_.jpg,
B0D1GVM3PF,Hemp Gummies - Advanced Hemp Gummies - Relaxing Gummy with Hemp Oil - 180 Count,Gummy,180 Count,44.95,$0.25,($0.25$0.25/count),4.0,571,false,false,false,false,when you subscribeExtra $10.00 off  when you subscribe,700+ bought in past month,THC gummies,https://m.media-amazon.com/images/I/71Xbj0pF7jL._AC_UL320_.jpg,
B0GDW6MXNK,"Hemp Gummies High Potency for Sleep, Anxiety, Pain Organic Edible Gummy Supplement for Adult Gummy Extra Strength Hemp Oil Extract",Gummy,,21.99,$0.27,($0.27$0.27/count),3.2,28,false,false,false,false,,,THC gummies,https://m.media-amazon.com/images/I/618mB7iWhJL._AC_UL320_.jpg,
B093381MLL,M inch 2 Pack Hemp Gummies 1 200 000mg High Strength Stress Relief Fruity Gummy Bear with Hemp Oil 100percent Natural Hemp Candy Supplements Promotes Sleep and Calm Mood 60 Count Pack of 2,Gummy,2 Pack,16.14,$0.13,($0.13$0.13/count),3.8,2200,false,false,false,false,,200+ bought in past month,THC gummies,https://m.media-amazon.com/images/I/715i0aGJ6IL._AC_UL320_.jpg,
B0GHNNR27G,"Hemp Gummies for Sleep, Pain, Anxiety (1 Pack) - High Potency Advanced Extra Strength with Pure Natural Hemp Oil, Best Hеmp Gummies for Adults - Low Sugar",Gummy,1 Pack,16.99,$0.21,($0.21$0.21/count),3.9,35,false,false,false,false,,200+ bought in past month,THC gummies,https://m.media-amazon.com/images/I/71Sj7SKKiUL._AC_UL320_.jpg,
B07L8F7W45,"WELLUTION Hemp Gummies – High Potency 985,000 MCG – Natural Fruity Bear for Relaxation and Peace - Fast-Acting - Gluten-Free - 60ct",Gummy,60ct,19.99,$0.33,($0.33$0.33/count),3.8,20142,false,false,false,false,,200+ bought in past month,THC gummies,https://m.media-amazon.com/images/I/71Himl3mPeL._AC_UL320_.jpg,
B0DCVX29J9,"Hemp Gummies Advanced Extra Strength - High Potency Hemp Gummy for Adults Relaxation - Natural, Organic, Sugar Free, Vegan, Fruity Edibles - 60 Count, 2-Month Supply",Gummy,60 Count,22.47,$0.37,($0.37$0.37/count),4.1,163,false,false,false,false,,50+ bought in past month,THC gummies,https://m.media-amazon.com/images/I/71Lw4pTdqGL._AC_UL320_.jpg,
B0FRNFRRW8,"WELLUTION Hemp Gummies XXL 4,000,000 MCG - Vegan Gummy Bears with Natural Hemp Oil, Omega 3-6-9, Vitamins A & D - 60ct",Gummy,60ct,26.97,$0.45,($0.45$0.45/count),3.8,20142,false,false,false,false,,100+ bought in past month,THC gummies,https://m.media-amazon.com/images/I/81sLyJ-J35L._AC_UL320_.jpg,
B0F53F8PTD,"HOOLOO Hemp Gummies 450,000mg for Deep Sound Bedtime Support and Discomfort Relief, Fruity Hemp Gummy Infused Omega 3, Vitamins, Made in USA",Gummy,,21.98,$10.99,($10.99$10.99/count),3.9,33,false,false,false,false,when you subscribeExtra 10% off  when you subscribe,100+ bought in past month,THC gummies,https://m.media-amazon.com/images/I/81j4s8EKC5L._AC_UL320_.jpg,
B0G3PBY4XR,"Hemp Gummies 2 Packs - for Sleep, Pain, Anxiety Relief - High Potency Pure Organic Supplement - with Natural Hemp Oil Extract Edible Gummy Vegan, Non-GMO",Gummy,2 Pack,25.89,$0.16,($0.16$0.16/count),3.5,25,false,false,false,false,when you subscribeExtra 20% off  when you subscribe,,THC gummies,https://m.media-amazon.com/images/I/71M8Xc1wxoL._AC_UL320_.jpg,
B0F6R839XB,"Hemp Gummies Edibles for Sleep and Calm, Hempseed Oil Infused Gummy Bears Candy- Fresh and Fruity-Made in USA-95 Bears",Gummy,,28.99,$0.31,($0.31$0.31/count),4.1,329,false,false,false,false,when you subscribeExtra 40% off  when you subscribe,500+ bought in past month,THC gummies,https://m.media-amazon.com/images/I/81PAlYcB8cL._AC_UL320_.jpg,
B0FHCHBTR7,"Hemp Gummies for Sleep, Pain,Anxiety Organic High Potency Extra Strength Hemp Oil Extract Edible Gummy Supplement for Adult Gummy 2 Packs",Gummy,2 Pack,30.99,$0.19,($0.19$0.19/count),3.6,27,false,false,false,false,20% off coupon appliedSave 20%  with coupon,50+ bought in past month,THC gummies,https://m.media-amazon.com/images/I/71fNACpUWDL._AC_UL320_.jpg,
B0DRNLPN5C,"Hemp Gummies for Sleep, Pain, Relax, Calm - High Potency Hemp Oil Infused Gummy Bears -Fruity Flavors - 100% Natural Omega Hemp Edibles (2 Pack)",Gummy,2 Pack,28.19,$0.18,($0.18$0.18/count),4.0,348,false,false,false,false,,50+ bought in past month,THC gummies,https://m.media-amazon.com/images/I/71YCjn1-SeL._AC_UL320_.jpg,
B0GV3TSDWZ,"Hemp Gummies for Sleep, Pain, Anxiety, Peace & Relaxation - High Potency Natural Hеmp Oil Infused Gummies - Natural Fruity Bear Hemp Gummy for Adults Vegan - 80Counts",Gummy,80Count,15.99,$0.20,($0.20$0.20/count),5.0,28,false,false,false,false,20% off coupon appliedSave 20%  with coupon,,THC gummies,https://m.media-amazon.com/images/I/715GRzxg4HL._AC_UL320_.jpg,
B0CZ3B7Z7X,"Natural Hemp Gummies 2,000,000 XXL Extra Strength - Vegan, Low Sugar, Non-GMO - 120 Counts",Gummy,120 Count,16.99,$0.14,($0.14$0.14/count),4.1,304,false,false,false,false,,100+ bought in past month,THC gummies,https://m.media-amazon.com/images/I/71KWBbAgn2L._AC_UL320_.jpg,
B0GSF9SS3Q,"Hemp Gummies High Potency for Pain, Sleep, Anxiety Extra Strength Hemp Oil Gummies - 100% Natural Organic Bear Candy Hеmp Supplement Gummy for Adults(2 Pack)",Gummy,2 Pack,26.59,$0.17,($0.17$0.17/count),3.9,57,false,false,false,false,20% off coupon appliedSave 20%  with coupon,,THC gummies,https://m.media-amazon.com/images/I/710Tbg7lZbL._AC_UL320_.jpg,
B0D1L2JNNW,"Hemp Gummies for Relaxation and Rest-Natural Hempseed Oil Gummies, Fresh Fruity Flavors Tasty Candy-Made in USA-Sleep Gummy Bear Edibles-90 Count Bears",Gummy,90 Count,29.99,$0.33,($0.33$0.33/count),4.2,355,false,false,false,false,when you subscribeExtra 40% off  when you subscribe,300+ bought in past month,THC gummies,https://m.media-amazon.com/images/I/81U23-z4f0L._AC_UL320_.jpg,
B0FZSR3GF7,Hemp Gummies Extra Strength for Pain Sleep Relax Anxiety - 100% Natural Pure Organic Hemp Oil Extract Vegan Low Sugar Edible Gummy for Adults (3 Packs),Gummy,3 Pack,29.99,$0.12,($0.12$0.12/count),5.0,29,false,false,false,false,5% off coupon appliedSave 5%  with coupon,50+ bought in past month,THC gummies,https://m.media-amazon.com/images/I/71OEx+nzYFL._AC_UL320_.jpg,
B0957TXZ2Q,"World's First Mushroom Complex Gummies with Lions Mane, Immune Support & Stress Relief, Nootropic Mushroom Supplement for Adults & Children (90 Chews 2500mg/serving)",Gummy,,27.98,$0.31,($0.31$0.31/count),4.3,2685,false,true,false,false,when you subscribeExtra 25% off  when you subscribe,2K+ bought in past month,THC gummies,https://m.media-amazon.com/images/I/71ImZ9k9FLL._AC_UL320_.jpg,
B0GJFN7JJV,Hemp Gummies For Deep Sleep Peace And Relaxation-Hemp Edibles Fruity Candy-Made In USA-95 Gummy Bears,Gummy,,17.99,$1.50,($1.50$1.50/ounce),4.1,34,false,false,false,false,when you subscribeExtra 40% off  when you subscribe,200+ bought in past month,THC gummies,https://m.media-amazon.com/images/I/81Qngrik8tL._AC_UL320_.jpg,
B0FJ7WJFSL,"Hemp Gummies 2 Packs - High Potency Pure Organic Supplement - with Natural Hemp Oil Extract Gummy Edibles Vegan, Non-GMO for Sleep,Pain,Anxiety",Gummy,2 Pack,28.69,$0.18,($0.18$0.18/count),4.0,38,false,false,false,false,,,THC gummies,https://m.media-amazon.com/images/I/71M8Xc1wxoL._AC_UL320_.jpg,
B0G3RVCDT4,Hemp Gummies for Deep Sleep-Calm and Peace-Made in USA Hemp Oil Gummy Bear Candy Edibles-93 Count,Gummy,93 Count,16.99,$0.18,($0.18$0.18/count),3.8,45,false,false,false,false,when you subscribeExtra 40% off  when you subscribe,100+ bought in past month,THC gummies,https://m.media-amazon.com/images/I/81b5P266HPL._AC_UL320_.jpg,
B094T2BZCK,"Goli Ashwagandha & Vitamin D Gummy - 60 Count - Mixed Berry, KSM-66, Vegan, Plant Based, Non-GMO, Gluten-Free & Gelatin Free Relax. Restore. Unwind, Pack of 1",Gummy,60 Count,14.96,$0.25,($0.25$0.25/count),4.5,62284,false,false,false,false,,20K+ bought in past month,THC gummies,https://m.media-amazon.com/images/I/71FKBWkm2SL._AC_UL320_.jpg,
B07NRL7ZPB,"WELLUTION Sugar-Coated Hemp Gummies – High Potency 2,985,000 MCG – Natural Fruity Bears for Relaxation and Peace - Fast-Acting - 60ct",Gummy,60ct,22.97,$0.38,($0.38$0.38/count),3.8,20142,false,false,false,false,,300+ bought in past month,THC gummies,https://m.media-amazon.com/images/I/81KmiU8XGJL._AC_UL320_.jpg,
B0BL79D45P,"Lemme Sleep Gummies with 5mg Melatonin, Elderberry, Magnesium, L-Theanine, Chamomile and Lavender, Drug-Free Nighttime Sleep Aid, Gluten Free, Gelatin Free, Non GMO, Berry Flavored (60 Count)",Gummy,60 Count,29.97,$0.50,($0.50$0.50/count),4.1,3417,false,false,false,false,when you subscribeExtra 10% off  when you subscribe,30K+ bought in past month,THC gummies,https://m.media-amazon.com/images/I/714yqx8SdOL._AC_UL320_.jpg,
B0GLZKGZTK,Fruit Gummies with Omega 3 6 9 Low Sugar for Adult,Gummy,,16.19,$0.20,($0.20$0.20/count),2.0,8,false,false,false,false,,,THC gummies,https://m.media-amazon.com/images/I/51saWKAYI1L._AC_UL320_.jpg,
B0BD78SK47,"(2 Pack) Hemp Gummies, Fruity Edibles Gummy Advanced 100% Natural High Potency Hemp Seed Extract Gummies - 120 Gummies",Gummy,2 Pack,22.95,$0.19,($0.19$0.19/count),4.1,717,false,false,false,false,,200+ bought in past month,THC gummies,https://m.media-amazon.com/images/I/71NYbNmHY2L._AC_UL320_.jpg,
B07RN1Z2RL,"OLLY Extra Strength Sleep Gummy, 5 mg Melatonin, L-Theanine, Chamomile, Lemon Balm, Sleep Aid, BlackBerry - 50 Count",Gummy,50 Count,13.34,$0.27,($0.27$0.27/count),4.5,4955,false,false,false,false,,8K+ bought in past month,THC gummies,https://m.media-amazon.com/images/I/7191ZAr2Y7L._AC_UL320_.jpg,
B086KHBY2J,"ZzzQuil PURE Zzzs Triple Action, Melatonin Gummies, Melatonin 6mg, 3X Melatonin, Sleep Aid with Ashwagandha, Calm Mood, Antioxidant Action, Sleep Aids for Adults, 60 Sleep Gummies",Gummy,,16.97,$0.19,($0.19$0.19/count),4.3,10538,false,false,false,false,$1.03 off coupon appliedSave $1.03  with coupon,20K+ bought in past month,THC gummies,https://m.media-amazon.com/images/I/71l85H3YzUL._AC_UL320_.jpg,
B0BTYX618V,"Plant People WonderSleep Mushroom Gummies Supplement for Sleep, No Melatonin with Reishi Super Mushrooms, Wild Elderberry Flavor, Sugar-Free (60 Count)",Gummy,60 Count,34.99,$0.58,($0.58$0.58/count),4.1,2208,false,false,false,false,when you subscribeExtra 20% off  when you subscribe,8K+ bought in past month,THC gummies,https://m.media-amazon.com/images/I/710-T3HVe3L._AC_UL320_.jpg,
B0F6MQPGNP,"Hemp Oil Gummies with Vitamin C – Vegan, Organic, Non-GMO, Gluten-Free, Fruity Flavor, 60 Gummies(1Pack)",Gummy,60 Gummies,8.99,$0.15,($0.15$0.15/count),4.1,20,false,false,false,false,5% off coupon appliedSave 5%  with coupon,50+ bought in past month,THC gummies,https://m.media-amazon.com/images/I/71n2+18CwHL._AC_UL320_.jpg,
B0FWRTF8W5,"(2 Pack) Hemp Gummies for Sleep, Pain, Anxiety - Advanced Extra Strength Supplement with High Potency Pure Hemp Oil Extract - Best Edible Gummy for Adults",Gummy,2 Pack,26.99,$0.17,($0.17$0.17/count),5.0,32,false,false,false,false,20% off coupon appliedSave 20%  with coupon,100+ bought in past month,THC gummies,https://m.media-amazon.com/images/I/71HOnEwpyZL._AC_UL320_.jpg,
